Le Journal du Centre,2018-01-31,Arrestation d’un homme masqué au Crédit agricole,"-L’agence bancaire du Crédit agricole de Saint-Amand-Montrond a été victime de ce qui semblait être une tentative de braquage hier, en fin d’après-midi. Un homme au visage caché par un foulard est entré dans l’agence. Très vite, les gendarmes de la brigade se sont rendus sur place. S’il n’avait pas d’arme à la 05n, les gendarmes ont retrouvé une baïonnette dans son sac. L’homme a été interpellé et placé en garde à vue pour tentative de vol par personne ayant dissimulé son visage.",Saint-Amand-Montrond,18200,9437
Le Berry Républicain,2018-01-31,Il tente de braquer le Crédit agricole,"Un homme de 23 ans était en garde à vue, hier soir, à la gendarmerie de Saint-Amand, après avoir été interpellé - plus tôt au Crédit agricole, rue Nationale. Vers 15 heures il est entré dans la banque, visage dissimulé, pour réclamer de l’argent. Il s’est retrouvé décontenancé, par le refus de l'équipe qui, avait pu donner l’alerte. Les gendarmes, dont certains patrouillaient à deux pas, l’ont interpellé cinq minutes plus tard, sur place. L’individu avait une baïonnette 05s n'a usé d’aucune arme.Il n’avait pas semblé menaçant pour un témoin de l'agence Allianz, voisine du Crédit Agricole. « J’ai croisé cet homme avec une capuche, remontant son foulard sur le nez, seul, tête baissée, au coin de la rue Fradet, sans sac à dos ni rien dans les 05ns, dit l’assureur. J'ai songé qu’il ne faisait pas froid pour se couvrir autant, pas plus. Quand j’ai appris la tentative de braquage à côté, j’ai saisi que j'avais vu l’auteur se préparer. » L’agence saint-amandoise du Crédit agricole, restée fermée la fin de journée d’hier, rouvre ce mercredi matin.",Saint-Amand,23200,493
La Dépêche,2018-01-31, Deux gardes à vue pour le braquage d'une épicerie en Lot-et-Ga­ronne,"-Moins d'un mois après le dernier braquage de l'épicerie de Saint-Barthelemy-d'Agenais, Marmandais, les gendarmes ont capturé deux suspects. Le premier mardi soir le second mercredi matin tôt. Tous deux ont été mis en garde à vue et entendus par les enquêteurs. Vers 20h30 deux individus ont surgi dans le commerce, menaçant la sexagénaire commerçante. Elle a résisté. L'un des agresseurs l'a frappée au visage, sans doute avec un poing américain. Elle est habituée au vol à 05n armée : les faits de janvier étaient les neuvièmes depuis six ans. Le 05re du village souhaite que des mesures soient prises pour protéger le commerce rural.",Saint-Barthelemy-d'Agenais,47350,1164
L'Union,2018-01-30,Une bijouterie attaquée à la disqueuse et à la masse à Chauny,"-Mardi vers 12 h 45, casse rue de la République. A nouveau, une bijouterie chaunoise est ciblée par les malfaiteurs. La bijouterie Decq, face à la CAF, a subi les assauts des voleurs. Selon les témoins, trois hommes sortis lourdement outillés d’une voiture ont attaqué la vitrine d’angle de la boutique. L’un a attaqué avec une disqueuse pour affaiblir les 3 cm d’épaisseur de vitrage, les deux autres ont frappé à coups de masses : deux trous dans la vitrine. Les casseurs ont passé les bras et raflé ce qui était à portée de 05n. Une étagère a été vidée de ses bijoux. Les individus ont alors fui dans leur véhicule. Ce casse express survient six mois après le braquage raté à la bijouterie Six, place du Marché-Couvert (5 08 2017, ouverture du rideau de fer). Les gendarmes mènent leur enquête, d'abord la recherche du véhicule utilisé pour ce casse.",Chauny,2300,11878
Le Dauphiné,2018-01-30,Échirolles : braquage matinal dans un bureau de tabac,"Deux hommes cagoulés ont surgi mardi vers 7 heures dans le tabac de la Commanderie, avenue Henri-Wallon à Échirolles. Armé d'un fusil, ils ont menacé le commerçant et ont raflé le tiroir-caisse et trois cartons de cigarettes avant de fuir. Nul n'a été blessé. Les policiers grenoblois sont venus procéder aux constatations et ont ouvert une enquête.",Echirolles,38130,36840
LP,2018-01-29,Paris : un couple de restaurateurs braqué à domicile,"Dans la matinée, un inconnu a frappé à leur porte, au 1er étage d’un immeuble du bd. de l’Hôpital, pour remise d’un colis. Ayant ouvert, les occupants ont été frappé par trois hommes cagoulés munis de revolvers. Ils ont mis un sac sur la tête des victimes, entravées au poignet par des colliers de serrage et ont raflé bijoux et argent d'un coffre caché dans une armoire, avant de fuir. Gérants d’un restaurant indien proche de chez eux, le commerçant et sa femme (hospitalisée après l’agression) ont vite donné l’alerte. Leurs braqueurs bien renseignés ont agi en plein jour, dans un immeuble voisin des locaux de la préfecture de police et proche du nouveau commissariat du XIIIe. Le 3e DPJ orienterait son enquête vers un ex-employé du restaurant, récemment « remercié ».",Paris,75010,2187526
LP,2018-01-28,Bagneux : l’équipe du Franprix soutenue par élus et clients après le braquage,"« Ici c’est un trou perdu ! La police ne passe pas. » Au quartier des Tertres-Cuverons à Bagneux. Jonathan Sanchez gère, depuis le mois de 03, un magasin Franprix. « Trois jours avant l’ouverture, je me suis fait voler de l’alcool et des marchandises », se désole le trentenaire. Les vitrines de son commerce portent encore traces de vandalisme du dernier réveillon de Noël et mardi, une de ses jeunes caissières s’est fait braquer. « Un gamin masqué lui a posé un pistolet sur la tempe en exigeant la caisse », dit le patron. Le malfaiteur, recherché par la police, a fui avec la caisse 05s sans blesser personne.L’accumulation de ces méfaits et le ras-le-bol général ont permis de rassembler une cinquantaine de gens, samedi matin devant le magasin. Entourée de commerçants, d’habitants, d’associatifs, Marie-Hélène Amiable, 05re (PCF) de la commune, a demandé « une police de proximité comme l’avait promise Emmanuel Macron ». « Il y a un problème de sécurité dans ce quartier comme dans bien d’autres en France, dit l’élue. Il faut qu’il y ait une police visible, présente dans le quotidien des gens ayant besoin d’être rassurés. »Comme Michel, 69 ans, qui jure pourtant qu’il ne réagit « pas par la peur ». Habitant du quartier depuis deux ans, il pense qu’il faut quand même « endiguer la délinquance pour préserver les commerçants et la bonne entente des habitants du quartier ». Jonathan Sanchez pense aussi que les forces de sécurité doivent être plus présentes. « Samedi dernier, une vingtaine de jeunes ont débarqué dans le magasin pour voler, j’ai alors appelé la police, 05s il n’y avait que 4 agents qui ont vite laissé tomber », regrette le gérant. « Ma caissière a 20 ans, elle vient de Normandie et cela fait 6 mois qu’elle travaille ici, dit le patron. Je lui ai donné du repos et elle va voir un psychologue depuis. » Le commerçant ne veut pas fermer, 05s craint qu’à force de braquages, vols et vitres brisées, la franchise quitte le quartier sans plus de supérette de proximité pour les habitants. La 05re a rappelé qu’une vidéosurveillance était prévue dans la ville et d'abord dans le quartier, 450 000 € d’investissement, d’ici 06.",Bagneux,92220,40918
La Montagne,2018-01-28,Encore un vol à 05n armée dans un tabac-presse: La serie noire se poursuit pour les buralistes puydômois.,"-Vendredi, fin d’après-midi, deux hommes armés, visages cachés, ont surgi dans un tabac, bd. Lavoisier à Clermont-Ferrand. Ils ont raflé la caisse (quelques centaines d’euros) et des cartouches de cigarettes, avant de fuir. La sûreté départementale enquête. Depuis mi-novembre, plus d’une vingtaine d’attaques (casses et braquages confondus) sont recensés dans le Puy-de-Dôme. Voici dix jours quatre malfaiteurs ont pillé un tabac du quartier Saint-Jacques, toujours à Clermont-Ferrand, ligotant la buraliste et sa vendeuse.",Clermont-Ferrand,63100,143886
Var-Matin,2018-01-27,Le braqueur s’en prend à la gérante du magasin,"-04ès l’heure de la fermeture, un braquage a été commis, jeudi dans le quartier de Saint-Jean-du-Var à Toulon. La gérante d’un magasin allait entrer dans sa voiture et a été abordée par un inconnu qui l’a menacée, brandissant un Taser sur elle. La gérante a dû rouvrir le magasin de vêtements et chaussures qu’elle venait de fermer tôt. Le braqueur a raflé le contenu d’un coffre, quelques milliers d’euros. La femme a reçu une gifle pour avoir levé ses yeux vers son agresseur. L’homme, au visage dissimulé, a fui à pied avenue FrançoisCuzin. Une enquête est ouverte à la Sûreté départementale.",Toulon,83100,171953
Le Télégramme,2018-01-27,Braquage de la boulangerie : huit mois ferme au Morbihannais,"-Vers 13 h le 19 janvier, un homme, visage caché par un tissu, portant capuche et lunettes de soleil surgit dans une boulangerie du bourg d’Arzano. Il menace la commerçante d'un couteau et fuit avec la caisse (428 €). Les gendarmes identifient vite un homme de 30 ans, issu de Plouay, dont le téléphone borne dans la commune lors des faits et l’immatriculation du véhicule a été relevée par un témoin. L’ADN retrouvé sur le couteau qu'il a jeté plus loin dans la rue achèvera de le confondre. Il est interpellé lundi matin ivre à son domicile, on retrouve dans sa voiture des débris de la caisse enregistreuse et le tablier qui cachait son visage. « Ma situation était désespérée, factures impayées, loyer en retard et la propriétaire me mettait la pression », a dit à la barre le prévenu, en comparution immédiate hier après-midi au tribunal correctionnel de Quimper. Regrets et excuses à la victime, trouvée prostrée derrière son comptoir par les gendarmes et aussi une rupture sentimentale récente l’ayant conduit à une tentative de suicide en octobre pour tenter d’expliquer son geste. « Il a joué les petits poucets en semant tous les indices pouvant l'identifier », dira son avocate qui evoque un acte suicidaire et plaide pour la non-dangerosité de son client. Elle a suggéré sa mise sous bracelet électronique alors que la procureure souligne la gravité des faits et requiert 24 mois dont 16 avec sursis, mise à l’épreuve avec obligation de soins, de travail ou de formation, interdiction d'aller à Arzano et 05ntien en détention. Des réquisitions suivies par le tribunal qui l’a aussi condamné à 2.000 € (préjudice moral) et 506 € (préjudice matériel).",Arzano,29300,1387
L'Est républicain,2018-01-27,Vol à 05n armée à Commercy : la garde à vue prolon­gée,"Le hard-discount Netto de Commercy a subi braquage vendredi vers 18h45. Un homme est arrivé avec un fusil, arme d'une catégorie à déclarer, devant les employés. Il a raflé environ 2 000 €. Les gendarmes ont interpellé à 19h 50 un individu de 26 ans, connu de la justice et l'ont mis en garde à vue. Le parquet de Bar-le-Duc a dit samedi soir qu’elle était prolongée pour préciser des éléments, jusqu'à 19h50 dimanche. Ilest encore trop tôt pour dire ce qui s’est passé. Une dizaine de témoins ont été entendus vendredi soir. Il n’y a eu aucune violence physique, personne n’a été blessé. Le Netto a rouvert ses portes samedi matin.",Commercy,55200,5536
France3 Nord,2018-01-27,Roubaix : une bijouterie violemment braquée dans le centre-ville,"-Un homme a été blessé lors du braquage d'une bijouterie du centre de Roubaix ce 26 janvier. Le braquage s'est produit vers 8 heures ce matin à la bijouterie Lauras, rue Pierre-Motte. Au moins deux individus auraient surgi et agressé le joaillier ouvrant son coffre-fort pour exposer ses bijoux en vitrine. Un coup de feu d'intimidation a été tiré. Les pompiers ont confirmé avoir transporté un ""blessé léger"" à l'hôpital Victor Provo de Roubaix, précisant que ce n'était ""pas un des braqueurs"". Les deux braqueurs étaient toujours en fuite vendredi. La PJ de Lille enquête.",Roubaix,59100,96990
LP,2018-01-26,Paris : les braqueurs de bijoux ratent leur coup dans le Marais,"-80 000 € de bijoux du joaillier Boucheron ont disparu 40 mn., après un braquage, jeudi à Paris. Vers 19h45 rue des Lions-Saint-Paul (IVe), deux convoyeurs Thémis, en retard, vont livrer de précieux bijoux à une cliente qui les a loués pour la soirée. Impatiente, celle-ci part sans les attendre. Les deux convoyeurs retournent à leur voiture avec les bijoux, ils sont assaillis par trois hommes qui les frappent à coups de pied, raflent leur sacoche et fuient vers la Seine. Les policiers les recherchent en vain. A 20h25, la gardienne d’un immeuble voisin prévient la police : une habitante a trouvé dans sa cour le paquet de bijoux encore sous scellés. Les enquêteurs du 1e DPJ enquêtent.",Paris,75010,2187526
France-Info ,2018-01-26,03eille : trois braquages en une heure de temps !,"Jeudi de 18 à 19 heures, la police de 03eille est intervenue sur trois braquages : à l'Estaque, La Valentine et dans le 13e arrdt. A priori, nul lien entre ces méfaits. A L'Estaque (16e), le gérant de la pizzeria ""La storia"" fait face à un homme muni d'une arme de poing. Sous la menace, le braqueur part avec un scooter, retrouvé peu après sur la L2. Quelques minutes après, nouvel appel aux policiers dans le 13e. Avenue des Olives, le Lidl a subi une tentative de vol. Un individu y surgit et exige l'ouverture du coffre-fort... qui vient juste d'être vidé. Le malfaiteur fuit les 05ns vides. 3e braquage du soir au Gifi de La Valentine. Deux hommes masqués et armés raflent deux caisses, environ 1 500 euros. La PJ est chargée de l'affaire.",03eille,13000,855393
20 Minutes,2018-01-26,Nord: Braquage d’une bijouterie au centre-ville de Roubaix,"Butin inconnu. Une bijouterie-joaillerie du centre de Roubaix, a subi un braquage vendredi à 8 h, à l’ouverture du magasin. Au moins deux individus armés ont surgi quand le bijoutier ouvrait son coffre à bijoux. Ce dernier a reçu un coup de crosse sur la tête. Les braqueurs ont raflé des bijoux et ont fui. La police a interpellé un suspect près des lieux du braquage et et l'a mis en garde à vue. Le bijoutier a été conduit à l’hôpital pour blessure à la tête. Une enquête est confiée à la PJ.",Roubaix,59100,96990
Voix du Nord,2018-01-26,« J’ai vu deux hommes sortir en courant du commerce »,"-Elle reste bouleversée. « C’était comme dans un film. On ne s’attend pas à ça à 8 heures du matin. » Approchant la 05rie de Roubaix vendredi matin, Sandra (prénom modifié) entend des cris. « C’étaient des appels à l’aide, dit-elle. J’ai cru qu'une femme se faisait violenter, peut-être dans un logement. J’ai continué ma route et, arrivée devant la bijouterie, j’ai vu deux hommes en noir et cagoulés sortir en courant du commerce. » Elle n’a pas vu d’arme et les a vus s’éloigner. « Mon premier réflexe a été d’aller à la bijouterie pour aider celui qui criait 05s des ouvriers m’en ont empêchée. On ne savait pas s’il y avait encore du monde à l’intérieur. J’ai attendu à proximité. Quelqu’un a appelé la police et je suis partie. » Quelques minutes avant, au moins deux individus armés surgissaient dans la bijouterie de la rue Pierre-Motte, face à la médiathèque, au centre-ville. Alors, le joaillier ouvrait son coffre-fort pour sortir des bijoux devant être installés en vitrine pour la journée. Un tir d’intimidation retentit. L’homme d’une soixantaine d’année est molesté et frappé d’un coup de crosse à la tête. Les braqueurs raflent des bijoux et fuient. Le préjudice n’est pas connu. « L’attaque a été virulente », dit une source judiciaire. Blessé à la tête, le bijoutier est conduit à l’hôpital. Ses jours ne sont pas en danger. La BRB de la PJ est chargée de l’enquête. Interpellé à côté, un suspect est vite été mis hors de cause. Une partie de la matinée, l’accès au centre-ville a été bloqué par la police pour laisser les enquêteurs procéder aux premières constatations.",Roubaix,59100,96990
Le Bonhomme Libre,2018-01-25,"Bar-tabac braqué, le voleur en fuite Liberté","Le 18 janvier, braquage d'un tabac du quartier du Chemin-Vert. A 19h15, un individu cagoulé surgit, menace d'un couteau l'employé au comptoir et exige la caisse. Vite, le voleur rafle quelque 1.500 euros et fuit. Une enquête de la police est en cours.",Caen,14000,105354
France3Occitanie,2018-01-25,Braquage avorté dans un garage automobile à Redes­san dans le Gard,"Le 24 janvier au soir, deux individus armés et cagoulés ont voulu braquer un concessionnaire de voitures de luxe à Redessan, Gard. Ils ont surgi au garage alors que le gérant, présent, allait partir. Ce dernier a été ""malmené"". En revanche, rien n'a été volé. Les gendarmes de Marguerittes, près de Nîmes, sont vite arrivés sur place 05s les deux individus avaient déjà fui.",Redessan,30129,4115
Nouvelle République,2018-01-25,Braquage et tentative de braquage à Saint-Aver­tin et Tours,"Mercredi soir à vingt minutes d'intervalle, ont eu lieu une tentative à Tours et un braquage à Saint-Avertin. Un mineur, impliqué dans l'une des affaires, a été interpellé. Mercredi, les policiers ont interpellé un jeune homme, né en 2000 05s mineur vers 19h40, allant vers les Rives du Cher. Il a été placé en garde à vue. Avec un autre individu qui a fui, il est impliqué dans la tentative de braquage d'une épicerie boulevard Wagner, au coeur du quartier Bouzignac, à Tours.Les deux individus (gantés, avec capuches) ont surgi dans le commerce avec un pistolet à billes, utilisé deux fois sur le gérant, qui, avec ses fils, a tenté de chasser les agresseurs. La victime est légèrement touchée à une pommette et à la cuisse. 20 minutes après, une boulangerie est ciblée à Saint-Avertin, av. du Lac. A 20h10, deux individus y surgissent et exigent la caisse des deux vendeuses, les menaçant d'un couteau. Tous deux sont gantés, portent des foulards et l'un d'eux, une casquette. Ils ont fui à pied. Préjudice inconnu.",Saint-Avertin,37550,15025
Le Journal du Centre,2018-01-25,Braquage raté dans un restaurant: Le braqueur tire un coup de feu pour intimider les clients du restaurant Lusitania,"Deux mois après l’échec d’un malfaiteur, arrêté par un passant après une attaque à 05n armée à la 05son de la Presse de Cosne-sur-Loire, un homme de 22 ans a raté son coup, mardi soir, au restaurant Lusitania, à Nevers. Le patron et des clients l’ont fait fuir et maîtrisé… « Sortez vos portefeuilles ! », hurle le braqueur, vers 20 h 30, en entrant dans de ce restaurant de spécialités portugaises. La quinzaine de clients croit à une blague en voyant surgir ce jeune au visage couvert d'une capuche, avec un pistolet, à air comprimé et une bombe lacrymogène. Nulle panique ni inquiétude 05s un coup de feu en l’air refroidit les convives qui lâchent couteaux, fourchettes et verres. 05s « nul n’a donné son portefeuille », dit le patron du restaurant.Sa femme s’approche du braqueur pour le ramener à la raison. « Calmez-vous, baissez votre arme », demande-elle en substance. L’homme vacille, manque d’assurance face à la quinzaine de paires d’yeux braqués sur lui et à son échec à recueillir le moindre centime ? Deux clients se lèvent, peu impressionnés par l’arme de poing et les jets de gaz lacrymogène. Le braqueur panique et fuit. 05s deux convives et le patron le coursent. Près du commerce, à l’angle des rues de la Préfecture et du Sort, le malfaiteur est plaqué au sol. « Il a été surpris. Il disait : “Lâchez-moi !” », dit le restaurateur. La police l'a placé en garde à vue. Mesure prolongée par le parquet, hier soir, où il sera déféré ce matin avant sa probable comparution immédiate, de05n, devant le tribunal correctionnel. ?",Nevers,58000,32990
L'Impartial,2018-01-25,Braquage de la supérette : deux jeunes voyous arrêtés,"La supérette de Gisors, rue de Dieppe a été braquée le 17 janvier 2018. Vers 22h, deux hommes cagoulés pénètrent dans cette épicerie nocturne, menacent le gérant d'un pistolet airsoft et raflent la caisse, 100€. Avant de fuir, l’un des individus asperge la victime avec une bombe lacrymogène. Le dispositif de recherches installé par la gendarmerie des Andelys a permis d’interpeller l’un des malfaiteurs peu après les faits. Le second mis en cause a été arrêté deux jours plus tard dans le temps de la flagrance par les gendarmes de Gisors. Les deux jeunes de 19 et 20 ans, issus du secteur étaient connus des forces de l’ordre. Déférés au parquet le 19 janvier ils sont mis en examen et en détention provisoire aux 05sons d’arrêt d’Évreux et de Rouen.",Gisors,27140,11537
Le Progrès,2018-01-25,Civrieux-d'Azergues: Braquage au tabac,"-Le 25 janvier vers 9 heures, des braqueurs cagoulés et munis de couteaux ont surgi au tabac de Civrieux-d'Azergues et ont raflé des cigarettes. C'est la quatrième fois que ce tabac subit un braquage, le dernier, en décembre 2017. Les gendarmes ont interpellé les suspects peu à près les faits, sur la commune de Lissieu.",Civrieux-d'Azergues,69380,1515
Pays Malouin,2018-01-25,Saint-Malo : une boulangerie braquée Intra-Muros,"La boulangerie-pâtisserie de la cathédrale, au cœur de Saint-Malo Intra-Muros, réputée pour ses spécialités bretonnes, a été braquée le 24 janvier. Vers 18h un homme, portant capuche, bonnet et écharpe, a surgi au commerce avec un couteau. Il a demandé la caisse à l’employée. Celle-ci a refusé et l’homme, menaçant, s'est servi lui-même et à fui à pied. Cavale précipitée lors de laquelle il a perdu des billets volés que des passants ont rapportés à la boulangerie. Le butin serait de 500 euros. Une enquête de police est en cours.",Saint-Malo,35400,46097
La Marne,2018-01-24,Tentative de braquage : les employés gazés,"-A 21 h 15 le 17 janvier, quatre individus cagoulés et gantés tentent de pénétrer dans le centre commercial Carrefour, situé Avenue des Pyramides, à Champs-sur-Marne. Le centre commercial ferme ses portes, un agent de sécurité est à l’entrée. Alors qu’il voit les quatre malfaiteurs approcher, certains munis d'armes de poing, il décide d’empêcher l’ouverture des portes. Les individus font demi-tour. Ils croisent un agent de sécurité accompagné d’une employée sur le parking, ils les prennent violemment à partie. L’employée et l’agent sont molestés et gazés à la lacrymogène. Jetée à terre, l’employée hurle et le vigile se défend. Les quatre malfaiteurs fuient en courant sur le parking. Ils sont récupérés par une voiture un peu plus loin. Les malfaiteurs n’ont rien volé 05s sont recherchés. La PJ de Meaux enquête.",Champs-sur-Marne,77420,25041
Le Télégramme,2018-01-23,Braquage à la boulangerie : une interpellation,"-Un Morbihannais trentenaire est en garde à vue depuis hier à la gendarmerie de Quimperlé, dans l’enquête sur le braquage d’une boulangerie-pâtisserie, vendredi dernier, à Arzano. Peu avant 13 h 30, un homme s’était introduit dans la boulangerie Chez Chantal et Chrihe, rue Auguste-Brizeux. Selon la gérante, seule au commerce lors des faits, l’individu avait une capuche, des lunettes de soleil et un foulard. Muni d’un couteau et en quelques secondes, il a raflé 280 € en liquide dans la caisse et a fui. La garde à vue devrait se prolonger de 24h et le suspect pourrait être déféré au parquet de Quimper jeudi.",Quimperlé,29300,12057
LP,2018-01-23,Braquage au Franprix de Bagneux,"Un malfaiteur a braqué un Franprix à Bagneux mardi. Vers midi trente, l'homme a surgi dans le magasin rue Fontaine-Gueffier. Caché sous un masque de Paintball il braque une arme de poing sur la caissière. Le malfaiteur a raflé la caisse sans blesser quiconque. La PJ 92 enquête.",Bagneux,92220,40918
Ouest-France,2018-01-22,Le Mans Braquage d'un Carrefour City,"Le Carrefour City du boulevard Mutuel, au Mans, a subi un braquage mercredi passé, vers 21 h 30, avant la fermeture de 22 heures. Il n'y avait plus de client dans le magasin, seulement deux caissiers. Les deux braqueurs sont repartis avec de l'argent. Ils sont en fuite.",Le Mans,72100,142946
LP,2018-01-22,Vigneux : une caissière brutalisée lors du braquage,"-Couteau sous la gorge, tirée par les cheveux. La caissière du Franprix de Vigneux-sur-Seine a vécu un calvaire vendredi : deux hommes sont entrés cagoulés et armés dans le supermarché. Ils ont laissé une marque rouge à la gorge de l’employée, à force d'appuyer avec la lame de leur couteau. Ils l’ont forcée à donner sa caisse, puis l’ont traînée vers une deuxième caisse dont la victime leur a encore remis l’argent. Les braqueurs ont fui avec moins de 150 €. La sûreté départementale enquête.",Vigneux-sur-Seine,91270,31574
Paris-Normandie,2018-01-22,"Braquage d’un fleuriste au Havre : une information judi­ciaire ou­verte, un suspect mis en examen","-04ès le braquage au marteau d’un fleuriste rue des Sports au Havre le 19 janvier au soir, le procureur a ouvert une information judiciaire pour « vol à 05n armée ». Issu d’Epinay-sur-Seine (93) le suspect interpellé (19 ans) a été mis en examen puis écroué. Le second suspect court toujours. Une centaine d’euros et un portable ont été volés, vendeuse 23 ans, et une apprentie, 20 ans étant dans le commerce. Choquées, elles sont indemnes.",Le Havre,76600,170147
