Vosges-Matin,2018-04-03,Arrêtés après leurs vols à 05n armée,"La caissière de la station essence Agip, sur l’aire de repos de Peuxy à Saint-Nabord, se souviendra de ce 1er 04 et de sa prise de poste. Il était 7 h lorsque deux individus, ni cagoulé, ni ganté 05s muni d’un couteau pour l’un d’eux, ont surgi dans magasin et menacé l’employée. La scène a duré quelques minutes - bien longues pour cette salariée, seule au magasin lors des faits, qui vivait le 2e braquage de sa vie. Elle a obéi et remis des cigarettes et la caisse aux braqueurs (40 euros). Une demi-heure plus tard, les deux hommes issus de Meurthe-et-Moselle s'arrêtaient à la station Total de Vincey. Avec l’argent volé plus tôt, ils mettent du carburant dans leur véhicule à l’immatriculation bien visible. Puis ont ciblé l’employée. Comme à Saint-Nabord, sous la menace d’un couteau, ils ont exigé la caisse et sont repartis avec quelques dizaines d’euros vers une autre station à Lunéville (54). Là, ils ont été chassés par l’employé.Au matin, pris de remords, un des braqueurs est venu à la gendarmerie de Gerbéviller (54). À la mi-journée, l’enquête, des gendarmes de Charmes, de Neufchâteau et de Nancy a permis d’interpeller le second individu à son domicile de Lunéville. Ils sont en garde à vue à la gendarmerie de Charmes et de Neufchâteau pour 48 heures. puis seront déférés au Parquet d’Épinal. Les deux copains de 25 et 26ans, avaient passé la nuit à la discothèque de Charmes puis ont raccompagné des amies à Remiremont. Durant le trajet l’idée de braquer a germé dans la tête des pieds nickelés. Ils avaient aussi fait halte à la station Total de la Croix Saint-Jacques à Saint-Nabord pour un vol à l’étalage.",Saint-Nabord,88200,4052
LP,2018-04-03,Mantes-la-Jolie : le braqueur de banque empoche 18 000 €,"Un braqueur solitaire a volé, mardi à Mantes-la-Jolie, d’une somme de 10 000 € à 18 000 € à la banque BCP. Vers 8 h 25, bd. du Maréchal-06, l’homme a surpris le directeur de l’agence qui ouvrait la porte. Il lui a plaqué un pistolet dans le dos et s'est fait ouvrir. Un 2e employé est entré à la banque. Les deux hommes ont été tenus en respect quinze minutes. Le voleur s’est fait ouvrir le coffre puis mis les billets dans un sac. Il est sorti en tenant le directeur, l'a relâché et a fui à pied. Les La BRB de la PJ de Versailles mène les investigations",Mantes-la-Jolie,78200,44299
Le Progrès,2018-05-31,Tarare : braquage au Marché aux affaires,"Le Marché aux affaires, sur le parking du supermarché Auchan à Tarare, a subi un braquage mercredi vers 19 heures. Avant la fermeture, un individu arrivé en scooter et muni d’une arme de poing a braqué le magasin. On ignore à présent le préjudice.",Tarare,69170,10582
L'Observateur,2018-05-31,Cambrai : Un homme placé en garde à vue suite au braquage du Coccinelle le 1er 05,"Mardi 1er 05, le Coccinelle du 05l Saint-Martin était l’un des seuls ouverts ce jour férié. Vers 12h, Philippe dit Pipo, ex-gérant du magasin, vient avec sa petite fille saluer ses ex-collègues. « Je parlais à la caissière quand j’ai vu entrer un homme avec un foulard sur la tête et des lunettes de soleil, dit le Pipo. Il s’est rué sur la caisse, m’a asséné un coup de couteau au biceps et a exigé la caisse. » N’écoutant que son courage, Philippe s’est jeté sur le braqueur pour lui prendre l’arme et le maîtriser 05s il a fui sans butin vers le beffroi. Philippe, le gérant et un client le pourchassent. Nouvelle altercation dans la rue. « L’homme a encore tenté de me poignarder et a pu fuir. Un individu a été arrêté par la police ce 30 05. « Il est mis en garde à vue jusque de05n 10h dans l'enquête"" dit une source. Pour l’instant, nul élément sur la personnalité de cet homme.",Cambrai,59400,32558
20 Minutes,2018-05-29,"Périgueux, ils braquent le chauffeur de bus pour repartir avec une quarantaine d'euros","Nouvelle agression sur le réseau de bus de Périgueux. Deux hommes munis d'un pistolet ont braqué un chauffeur mardi vers 7h30 à l’arrêt « Les Lilas », av. Georges Pompidou. Ils ont fui avec une quarantaine d’euros, laissant les pièces sur le trottoir. Le chauffeur de 27 ans, choqué, a été soigné puis a porté plainte. La CFDT dénonce la nouvelle agression, la 2e en deux mois, et exige l’installation d'une vidéosurveillance dans les bus. Mardi, l’un des deux malfaiteurs était à visage découvert et a fui avec son complice. Le chauffeur reprendrait le travail mercredi.",Périgueux,24000,29966
Le Républicain,2018-05-26,Lorrain Braquage à Kuntzig : la salariée témoigne,"Sarah* travaille dans la boulangerie de Kuntzig, Grand’Rue, depuis quatre ans. Hier, elle a pris son service à 6 h du matin, comme d’habitude. Vers 11 h, elle était dans l’arrière-boutique quand la clochette signalant une entrée a retenti. « Il n’y avait personne dans la boulangerie, bien entendu… », souffle Sarah. L’homme a bien sûr choisi son moment. La vendeuse ne se souvient pas des détails. Tout s’est passé vite. 05s elle dit s'être retrouvée face à un individu armé d’un couteau, de l’autre côté du comptoir. Son visage était caché par un foulard. « Il m’a demandé où se trouvait la caisse. »Le jeune agresseur la suit « Il ne m’a pas touchée », dit la victime. Sarah ouvre le tiroir. « Je n’ai pas cherché à comprendre », dit-elle. Il rafle les 150 € de recette et fuit à pied dans un premier temps. La vendeuse d’une trentaine d’années, reste seule et fond en larmes. Peu après son agression, ses joues sont encore noircies. 05s Sarah est décidée à ne pas plier. « J’ai appelé mon patron direct. » qui travaillait aux ateliers de Distroff lors du vol. Il a prévenu les gendarmes et rejoint la salariée à la boulangerie de Kuntzig. Le magasin est fermé vendredi. Un dispositif spécial a été déployé. Vers midi, l'investigation criminelle était sur place. Les gendarmes de Guénange et d’Uckange ont été mobilisés avec la brigade de recherches. Des éléments ont été recueillis. L’enquête se poursuit.",Kuntzig,57970,1314
Lille-Actu,2018-05-25,Wattrelos. Vol à 05n armée au Carrefour Contact,"Vol à 05n armée. Vers 16 h 30 le 24 05 un individu est entré au Carrefour Contact de Wattrelos (Nord), arme au poing. 04ès avoir pointé son arme sur la caissière, l’homme est reparti avec le contenu de la caisse. L’individu est entré dans le Carrefour ganté, cagoulé et armé. Tout a été très vite, il s’est enfuit avec un complice en Citroën C3, dit une source policière. La somme dérobée s’élève à 480 euros. Une enquête est ouverte, les deux hommes sont toujours recherchés.",Wattrelos,59150,40958
LP,2018-05-25,Vaux-sur-Seine : le braqueur du bar-tabac venait de sortir de prison,"Trois hommes de 22 et 23 ans, soupçonnés d’avoir braqué un tabac de Vaux-sur-Seine le 30 04 dernier, après tentative sur un autre à Menucourt (Val-d’Oise), ont été mis en examen vendredi à Versailles, pour vol et tentative de vol à 05n armée. Deux sont écroués à Osny (Val-d’Oise) et à Bois-d’Arcy ; le troisième est sous contrôle judiciaire. Ils ont été interpellés en début de se05ne à Meulan, par la BRD de la PJ de Versailles. Tous connus de la police pour trafic de stupéfiants, ils ont été vite identifiés par la voiture utilisée pour l’attaque et à la vidéosurveillance. L’un d’eux conduisait sa propre voiture et portait un bracelet électronique, permettant de le géolocaliser à tout moment.A 19 h 45, deux hommes cagoulés, gantés et munis de fusils surgissent au tabac de la rue du Gal.-de-Gaulle où sont une vingtaine de clients. L’un d’eux pointe son fusil et exige du commerçant des cartouches de cigarettes et la caisse, quelques milliers d’euros. Pour faire accélérer, l’un des voleurs tire en l’air. La décharge perce le plafond du tabac. Les malfaiteurs raflent leur butin, oubliant un sac, et fuient dans une Peugeot 307 à la plaque cachée à l'adhésif. La police lie vite à un fait similaire commis plus tôt à Menucourt. Deux malfaiteurs cagoulés, gantés, armés de fusils et arrivés dans la même voiture avaient voulu pénétrer dans un tabac. 05s le gérant, les voyant arriver, leur a baissé le rideau de fer au nez. La PJ a vite identifié un premier suspect à Meulan comme propriétaire de la Peugeot 307 avant de remonter à des complices, de ses relations. Les perquisitions n’ont pas retrouvé le butin ou les armes. Un fusil à canon scié a été découvert au logis d’un des trois hommes.",Vaux-sur-Seine,78740,4927
LP,2018-05-25,Courbevoie : braquage à la boulangerie,"Vendredi, l'homme au signalement imprécis a surgi dans la boutique, av. des Etudiants à Courbevoie. La boulangère était avec deux clients. Le malfaiteur a sorti son arme, sa 05n plongeant pour rafler la caisse. La boulangère l’ayant vidéé juste avant, le malfaiteur a fui avec 40 €. Les clients, réfugiés au salon de coiffure voisin, ont donné l’alerte. Quand la police est arrivée, le braqueur avait fui. Le commissariat local est chargé de l’enquête.",Courbevoie,92400,81719
Le Progrès,2018-05-25,Couzon-au-Mont-d’Or : tentative de braquage au bureau de tabac,"-7h45 au tabac de Couzon-au-Mont-d’Or. le fils de la propriétaire travaille à la place de sa mère, occupée. Soudain, deux individus entrent et braquent l’employé. «La caisse ! Vite !». L’arme est fausse, la victime le voit. Une minute après, les deux malfaiteurs partent les 05ns vides. Les gendarmes quadrillent le centre de Couzon. Voisins questionnés, vidéos de surveillance exploitées. L’enquête est en cours.",Couzon,3160,299
LP,2018-05-23,Seine-et-Marne : nouvelle attaque d’une boutique de téléphonie à Nemours,"-A Nemours, cinq jours après le cambriolage du magasin Orange, celui de SFR a subi une attaque similaire mercredi. Vers 14 h 35, deux hommes munis de cutter ont surgi dans la boutique rue de Paris au centre-ville, et ont forcé les vendeurs à leur donner des cartons de portables. Une centaine de smartphones, dont le dernier Apple, a été volée. Préjudice, plus de 100 000 €. « Des prélèvements ont été effectués par la police scientifique », dit une source ; l’affaire est confiée au commissariat de Nemours. La nuit du jeudi d'avant, quatre cambrioleurs avaient volé une centaine de téléphones chez Orange. Vite sur place, les policiers avaient interpellé deux des quatre suspects après une course-poursuite. Le passager avant avait jeté des boîtes de téléphones portables sur la voiture des policiers. Cette fois-là, les téléphones avaient été récupérés. Jugé mardi en comparution immédiate au tribunal de Fontainebleau, l’un des deux hommes, connu de la justice, a été condamné à six mois fermes et incarcéré. Son complice, inconnu, a pris quatre mois avec sursis.",Nemours,77140,13081
Puissance Info,2018-05-23,Nouveau braquage au Tabac Le Khédive à Vitry,"-Le Khédive, tabac de Vitry-le-François, a été à nouveau braqué hier vers 7 heures, peu après l'ouverture. L'individu, non-armé 05s masqué et menaçant, a fui avec 300 euros en espèces et des paquets de cigarettes. Second braquage pour ce commerce en moins d'un an. Au premier, l'homme avait été interpellé moins d'un mois après.",Vitry-le-François,51300,12133
La République du centre,2018-05-22,Le tabac de Ménestreau-en-Villette victime d'un braquage,"-Le tabac ""Le Saint-Thibault"", rue du Bourg à Ménestreau-en-Villette, a été braqué, mardi. Vers 5 h 20, le bar étant fermé, deux hommes cagoulés et gantés ont attaqué le patron, profitant d'une porte non verrouillée. ""Je rangeais la presse et les invendus. Je suis sorti pour voir ma vitrine et n'ai pas fermé en rentrant, dit le patron. Ils devaient me guetter, ils sont entrés et ont exigé la caisse. J'ai dit que vu l'heure, elle était vide. L'un me braquait avec son fusil, l'autre m'a jeté un sac de sport en me disant de le remplir de cigarettes. J'ai jeté :""Fais-le toi-même !"" Dans la bagarre, le commerçant prend un coup de crosse à l'omoplate, puis à terre, des coups de pied au ventre. Les deux braqueurs fuient avec quelques dizaines de paquets de cigarettes. ""Un troisième homme devait guetter dehors et un quatrième attendait en voiture. Il faisait jour, j'ai tenté de lire la plaque 05s la voiture n'en avait pas.""",Ménestreau-en-Villette,45240,1468
Paris-Normandie,2018-05-22,Braquage avorté dans une supérette de Saint-Léger-du-Bourg-Denis,"-Le 20 05 2018 vers 13 h 15, peu avant la fermeture, un homme, capuche en tête et bas du visage masqué, surgit dans la supérette Coccinelle, route de Lyons à Saint-Léger-du-Bourg-Denis. Gazeuse de lacrymogène et 05n gantée, il exige la caisse. L’un des trois employés refuse et lui conseille de fuir, car il n’aurait rien, dit la police. Le braqueur fuit enfin à pied. L'enquête est confiée à la brigade de sûreté urbaine d’Elbeuf-Rouen.",Saint-Léger-du-Bourg-Denis,76160,3450
La Voix du Midi,2018-05-21,Deux individus interpellés à Aix-en-Provence pour le braquage de l’épicerie de Calmont,"-Belle affaire élucidée par les gendarmes de Villefranche-de-lauragais. 04ès quelques se05nes d’investigations, les militaires ont interpellé le 17 05 2018 les deux auteurs du braquage commis le 7 04 2018 à l’épicerie de Calmont. Ces deux hommes de 24 et 27 ans, habitant près de Calmont ont été arrêtés à Aix-en-Provence où ils s’étaient réfugiés après leur méfait. Ils seront jugés par le tribunal correctionnel de Toulouse, le 22 05 2018. Le 7 04 2018, vers 17 h, les deux individus étaient entrés à l’épicerie de Calmont, casqués et munis d’un revolver d’alarme. Ils avaient frappé violemment un client à la tête et franchi le comptoir, menaçant la gérante et exigeant la caisse. Surpris par une employée venue de l’arrière boutique, les deux braqueurs l'avaient aussi menacée tirant un coup de revolver dans le plafond. 05s laissant choir leur arme dans le local, ce qui avait entraîné leur fuite précipitée. Partis sur leur deux-roues, les auteurs avaient raflé près de 500 euros en numéraire et paquets de cigarettes. Vite arrivés sur place, les pompiers avaient soigné le client et l'avaient transporté vers un hôpital. Les gendarmes avaient installé un dispositif de recherches 05s sans succès. Les investigations des gendarmes de Villefranche-de-Lauragais ont payé assez vite. Les techniciens en identification criminelle ont permis de retrouver ces individus d'une vingtaine d’années, l’un connu des gendarmes. Cachés à Aix-en-provence après leur acte, les braqueurs sont arrêtés le 17 05. Une perquisition à Pamiers, Ariége, permet aux enquêteurs de trouver le deux-roues utilisé lors du braquage. Présentés au parquet le 19 05, les mis en cause sont incarcérés avant comparution immédiate au tribunal correctionnel de Toulouse, mardi 22 05 après-midi.",Aix-en-Provence,13090,142482
Objectif Gard,2018-05-20,ALÈS: Braquage chez un fleuriste dimanche après-midi : l’agresseur en fuite,"Un individu sous un casque intégral a surgi dimanche vers 15h30 chez un fleuriste d'Alès. Il a raflé la caisse, menaçant l'employée, alors seule, d'une arme ; elle n'est pas blessée, 05s très choquée. Le braquage est advenu au croisement de la route d'Uzès et de l'ex-route de Nîmes, à Alès, au quartier de "" la Pierre Plantée "". L'individu a pu fuir, malgré l'arrivée rapide de la police. Il est recherché. Une enquête du commissariat d'Alès est en cours.",Nîmes,30900,150610
La Dépêche,2018-05-20,Interpellés à Aix-en-Provence après un braquage à 05n armée à Calmont,"Deux Haut-Garonnais ont été interpellés jeudi, suite à un braquage commis dans une épicerie de Calmont, est du département. Le 7 04, deux individus débarquent dans l'après-midi dans le magasin armés d’un pistolet d’alarme. Le client au comptoir essuie un coup de poing et tombe à terre. La gérante, menacée, donne la caisse aux malfrats qui raflent en passant des paquets de cigarettes. L’intervention d’une autre employée, elle aussi menacée, n’a pu les dissuader. Pire, le porteur de l’arme tire au plafond avant de fuir avec un complice sur un 2-roues. 04ès les soins du client blessé par les pompiers, les gendarmes de Villefranche-de-Lauragais ont enquêté jusqu’à Aix-en-Provence où ils ont localisé les braqueurs, réfugiés dans la famille. Le 2-roues a été retrouvé à Pamiers 05s ces deux hommes de 24 et de 27 ans sont issus du lieu du vol. L’un d’eux est connu de la police. Présentés à un magistrat de Toulouse, ils seront jugés en comparution immédiate mardi.",Aix-en-Provence,13090,142482
Nice Matin,2018-05-19,Braquage à 05n armée : en fuite avec 8 000 euros,"-Un hélico dans le ciel, des véhicules de gendarmerie, des hommes équipés et mobilisés, tout un quartier en émoi devant ce dispositif. Hier après-midi, la gendarmerie de Valbonne a déployé de gros moyens sur la zone des Trois-Moulins, quartier du nord de la cité des Remparts, proche de l'enceinte de basket AzurArena. L'objet de l'agitation, notamment le déploiement du dispositif Orsec ? La recherche de deux hommes fuyant à pied et armés, suite au braquage d'un loueur de véhicules de tourisme avec chauffeur à qui ils auraient braqué plusieurs milliers d'euros.De grands moyens pour tenter d'attraper les deux malfaiteurs, ayant volé 8 000 euros à un loueur de VTC. Cagoulés, l'un muni d'une arme de poing, ils auraient raflé l'argent avant de fuir à pied et n'ont pas encore été arrêtés. Si le braquage a eu lieu en zone police (Antibes), les deux malfaiteurs ont pu fuir en zone gendarmerie (Biot), le quartier des Trois-Moulins étant à la limite des deux, d'où le déploiement de militaires et d'importants moyens.",Valbonne,6560,13325
France Bleu 05enne,2018-05-18,Braquage du Proxi à Laval : deux adolescents interpellés,"Lundi 14 05, à 9h40, deux hommes pénètrent dans la supérette Proxi du quartier des Fourches à Laval pour rafler la caisse. La gérante refuse et les deux individus fuient. Les braqueurs portent une cagoule 05s la vidéo-surveillance permet aux enquêteurs d'identifier les chaussures d'un des individus et une mèche blonde sortie de la cagoule. Mercredi, les policiers lavallois vont au logis de l'un des suspects, jeune majeur, dans ce même quartier des Fourches. Les policiers reconnaissent les baskets. Dans l'appartement, un autre jeune de 17 ans est présent. Interpellés et mis en garde à vue, ils avouent les faits. Connu de la police, l'ado de 18 ans dit avoir jeté l'arme (factice ou non) dans la rivière 05enne. Le majeur passera en comparution immédiate au Tribunal correctionnel de Laval pour tentative de vol avec arme en réunion. Le mineur sera convoqué par le juge des enfants.",Laval,53000,49728
78 Actu,2018-05-17,Yvelines. Trois individus braquent la recette d’une station-service à Épône,"A la sortie d’Epône (Yvelines), sur la bretelle d’accès à l’autoroute A 13, la station-service Total Access a été braquée vers 13h30. Un convoyeur de fonds y récupérait les recettes de la vente du carburant. Trois individus cagoulés ont surgi d’une voiture et ont raflé la caisse après menaces et intimidations. Selon l’enquête, nulle arme n’a été utilisée par les malfaiteurs et le personnel n’a pas été blessé. La voiture des braqueurs a fui vers le Vexin. Une enquête est lancée, la police était d’ailleurs vite sur place.",Epône,78680,6503
76 Actu,2018-05-17,"Armé d’un couteau, un jeune homme exige la caisse d’un magasin de vêtements en Seine-Maritimebraquage","-Tentative de braquage dans un magasin de vêtements de Seine-Maritime, le 16 05 2018. Un jeune homme est entré dans une boutique, rue du château à Yvetot, dans l’après-midi. « Avec un couteau de cuisine à la 05n, il a exigé la caisse », dit une source judiciaire. Seulement, celle-ci était vide. Le braqueur a fui. Un chien renifleur et le Peloton de surveillance et d’intervention de la gendarmerie ont été dépêchés sur place. Les enquêteurs ont vite repéré un homme correspondant au signalement en gare d’Yvetot. L'homme d’environ 25 ans a été interpellé et a reconnu les faits en garde à vue.",Yvetot,76190,11859
BFMTV,2018-05-16,Laval: elle refuse de donner la caisse de sa supérette et fait fuir les braqueurs,"Ils pensaient aisément rafler la caisse, 05s Lydie, patronne d'une supérette, a réagi. Lundi matin, deux hommes cagoulés ont surgi dans l'épicerie d'un centre commercial de Laval, avec un pistolet et exigeant la caisse. Lydie a refusé de céder et les a mis en fuite. ""Je ne les ai pas vus entrer. J’ai juste vu un grand braquer son pistolet sur moi. Je n'ai pas réagi. Je n’ai pas tout de suite compris ce qui se passait"", dit-elle. Devant l'absence de réaction, un braqueur contourne la caisse et braque de nouveau son arme sur la commerçante. Nouveau refus de Lydie: ""Je lui ai dit : 'non je ne donnerai pas ma caisse'. Il m'a repoussée pour aller au tiroir-caisse, tirant sur mon col et me frappant au visage"". Le 2e braqueur veut ouvrir le tiroir-caisse, sans succès: ""Quand ils ont compris que je ne donneraia pas la caisse, ils ont fui"". 04ès l'agression, Lydie et ses deux stagiaires reprennent le travail puis appellent la police: ""J'étais secouée, j'ai perdu mes lunettes sans m'en apercevoir"".",Laval,53000,49728
La Voix du Nord,2018-05-15,Une boulangerie Paul fermée après un braquage matinal,"Ce mardi vers 5 heures, des individus ont surgi à la boulangerie Paul, avenue du Grand-Cottignies, à Wasquehal, fermée pour la journée. « Suite à un cambriolage, votre magasin est fermé ce 15 05. Nous rouvrirons le 16 05, à 6 h 30. Merci de votre compréhension ». Les clients venant acheter du pain ou des sandwiches chez Paul, mardi midi, lisaient l’affiche sur la porte vitrée de la boulangerie. Porte où manque un panneau de bois, trace de l’attaque survenue plus tôt le matin.",Wasquehal,59290,20479
L'Est républicain,2018-05-14,Braquage à la station-service,"-Samedi, vers 19 h, la station Avia, 2 avenue Paul-Keller, a subi un vol à 05n armée. Tandis qu’un individu restait à l’extérieur ; un second, visage grimé, entrait à la boutique, arme de poing en 05n. Il bousculait l’employée, très choquée, pour rafler la caisse. Un 05gre butin, moins de 200 € semble-t-il, puis fuite avec son complice, à pied, par les Promenades. Une patrouille les a aperçus sans parvenir à les rattraper. Il y a moins de trois mois, la station Total en face avait été braquée un samedi soir. L’auteur des faits, toxicomane, avait été interpellé deux jours après.",Toul,54200,15832
Ouest-France,2018-05-14,Laval. La supérette des Fourches victime d’une tentative de braquage,"-A 9 h 40, le 14 05 2018, deux malfaiteurs encagoulés font irruption dans la supérette Proxi, rue du Docteur-Roux, à Laval. L’un sort une arme de poing – peut-être factice – et demande la caisse à la gérante, qui refuse. S’en suit une bousculade entre eux, l’autre individu restant à l’écart. Face à cette résistance déconcertante, les deux malfaiteurs ont fui à pied, direction inconnue. Une salariée et un client, ont assisté à la scène. La brigade de sûreté urbaine a ouvert une enquête et recherche les deux braqueurs. Une aide a été prévue pour soutenir les victimes, choquées.",Laval,53000,49728
LP,2018-05-14,Limay : braquage au Franprix,"Deux hommes gantés ont attaqué dimanche vers 9 heures le Franprix, rue de Paris, à Limay. Ils ont usé de gaz lacrymogène dans le magasin puis ont pris une caissière en otage et raflé la caisse, 150 €. Sous la menace, l’employée de 29 ans les a conduits au coffre, que le gérant a dû ouvrir. Ils l’ont vidé de près de 2 500 €, et ont fui en voiture. Incommodée par la lacrymogène, la caissière été soignée par les pompiers.",Limay,78520,16820
Le Dauphiné,2018-05-14,Cran-Gevrier : braquage au Franprix,"-A 7h30 lundi matin, un individu masqué a surgi au Franprix, hauteurs de Cran-Gevrier à Annecy. Muni d'une arme il a forcé un employé à la conduire à le direction puis aux coffres. L'homme a fui avec le contenu de deux caisses, quelques centaines d'euros. La police a ouvert une enquête.",Cran-Gevrier,74960,18264
Lille Actu,2018-05-14,Vol à 05n armée dans une pharmacie à WasquehalBraquage,"-Braquage dans une pharmacie de Wasquehal (Nord) samedi 12 05 2018. Vers 11 h 45 un individu surgit à la pharmacie, rue Henri Jovenaux. Arme de poing à la 05n, il menace la pharmacienne, exigeant la caisse. La victime obéit et le malfaiteur rafle un fonds de caisse et fuit. Le préjudice est inconnu. Une enquête est ouverte, l’individu est recherché.",Wasquehal,59290,20479
