Nord Littoral,2019-02-20,Le Chick a rouvert après le braquage,"Ce mardi matin, on voyait à nouveau la lumière éclairer la vitrine de la boutique Chick, 537 av. Salengro. 04ès le braquage que la gérante, Virginie, a subi vendredi après-midi, elle a pris quelques jours de repos. Sa boutique, c’est son bébé, ce qui explique qu’elle ait fermement résisté à la tentative de braquage, même face au canon d'arme pointé sur elle : « Je n’ai pas réfléchi, c’est juste que non, on ne me prendra pas cette caisse. Ça fait douze ans que je suis là et que je travaille dur, je ne vais pas donner l’argent que je gagne comme ça. »Virginie n’a pas tremblé quand l’agresseur est entré au magasin, 05s a quand même eu peur quand elle l’a vu armer le pistolet, avec ce bruit caractéristique qui suggère que l’arme était bien en métal. L’auteur du braquage est toujours recherché, comme celui du tabac le Narval, peut-être le même, quoique les enquêteurs ne s’avancent pas. Des empreintes ont été relevées par la police scientifique dans le magasin, et Virginie espère que cela sera utile : « Il n’avait pas de gants, et le matin, j’avais nettoyé la porte, donc il ne doit y avoir que mes empreintes, celles de mon ami, et les siennes. » Le résultat de cette prise d’empreinte et d’ADN ne sera connu qu'en 04.",Calais,62100,73911
Evasion FM,2019-02-20,Braquage lundi soir à Chantilly,"-Deux individus masqués ont braqué une station-service avenue du Maréchal Joffre. Ils étaient munis d'une arme de poing et ont demandé la caisse à l'employé, qui a ensuite été aspergé de gaz lacrymogène pendant que les deux individus fuyaient. Hier, l'employé était entendu par la police. Une enquête est en cours.",Chantilly,60500,10863
LP,2019-02-20,Neuilly : braquage à la boutique Bouygues,"Mercredi vers 10 heures, deux hommes casqués et gantés ont surgi à la boutique Bouygues. Ils ont menacé les vendeurs d'une arme de poing et volé des dizaines d'iPhone X, vendus millier d’euros par appareil. En octobre, la boutique Orange de Neuilly était attaquée. Puis, en novembre, une boutique SFR, à Bois-Colombes. Et le 3 janvier, toujours le même scénario, deux braqueurs ciblaient une boutique SFR à Suresnes.",Neuilly,58420,118
Le Progrès ,2019-02-20,"Haute-Loire : Braquage à Retournac, le suspect en détention provisoire","Il est soupçonné du braquage du tabac, place de la République, à Retournac, vendredi soir. Lors de son interpellation, de l’argent a été trouvé à son logis de Monistrol-sur-Loire, avec des cartouches de cigarettes. Une information judiciaire a été confiée à un juge d’instruction. L’homme pourrait être aussi lié à deux autres braquages, commis en moins d’une se05ne dans l’Yssingelais. Samedi 9 février, la boulangerie Alibert, à Monistrol-sur-Loire, était la cible d’un vol à 05n armée, puis le coiffeur Kath S’en Mêle, à Bas-en-Basset, jeudi soir. Méthode semblable dans les trois cas : un homme seul surgit dans les commerces à la fermeture, masqué, il menace le personnel d’une arme de poing et rafle la caisse.",Retournac,43130,2929
Le Télégramme,2019-02-19,Brest. Deux blessés dans le braquage d’un Netto,"-Lundi peu après 19 h 15, un homme masqué et armé a menacé deux salariés du Netto de Bellevue, à Brest, sortant du magasin, pour se faire ouvrir le coffre. « Il a tiré en l’air, et frappé la gérante et un salarié de la crosse de son arme », dit un salarié. Le magasin était fermé et seuls quatre employés étaient présents. Le braqueur a fui avec une part de la recette du jour, dont le magasin n’a pas donné le montant. Ses deux victimes ont brièvement été hospitalisées dans la soirée, tandis que les enquêteurs de la police menaient leurs investigations. Ils devraient pouvoir exploiter la vidéosurveillance du magasin. L’enquête est confiée à la PJ. Le Netto a ouvert ce mardi matin, malgré le choc subi par les salariés. Il avait déjà été braqué en 2010. Vendredi passé, le Carrefour Market de la rue Édouard-Corbière était la cible d’un homme armé d’un couteau.",Brest,29200,140064
"La Commère, ",2019-02-18,"Bas-en-Basset : un salon de coiffure également victime d'un braquage, un suspect interpellé","Alors qu'une boulangerie a subi un premier braquage il y a dix jours à Monistrol-sur-Loire et qu'un bureau de tabac était attaqué vendredi soir à Retournac, on apprend lundi qu'un salon de coiffure a aussi été braqué, bd. de la Sablière à Bas-en-Basset. Le salon Kath s'en mêle, repris par une jeune femme, a été braqué jeudi soir à la fermeture. Cagoulé et ganté, le voleur s'est présenté vers 19 h 20. 04ès le départ de derniers clients, la coiffeuse avait baissé le rideau. C'est alors que le voleur est entré.La coiffeuse raconte : ""Il avait un revolver et a réclamé la caisse. 30 euros ne suffisaient pas. Il a fouillé mes affaires personnelles. Il devait y avoir 60 euros. Ça n'allait encore pas. On est revenu au salon où il a trouvé une pochette contenant de l'argent. J'ai réussi à fuir avec elle. J'ai traversé le boulevard et il m'a rattrapé à la pizzeria. J'ai crié et le pizzaiolo est sorti. Le voleur m'a piqué la pochette et a fui en courant. Le pizzaiolo a essayé de le coincer en voiture 05s ne l'a pas trouvé."" Terrifiée, la coiffeuse se cache dans son salon en attendant les gendarmes. Le pizzaiolo retrouve la pochette. 15 euros ont été volés. 04ès ces trois braquages en une se05ne, les gendarmes ont interpellé un homme, mis en garde à vue. Leur enquête doit déterminer la relation entre les affaires et le rôle de cet individu.",Bas-en-Basset,43210,4348
LP,2019-02-18,Breteuil : braquage au supermarché Aldi,"-Le Aldi de la zone artisanale de Breteuil a été braqué, lundi peu avant midi. Trois hommes cagoulés ont surgi au supermarché, munis d’armes de poing. Sous la menace, ils se sont fait ouvrir le coffre du magasin, qu’ils ont dévalisé. Ils ont fui en voiture avec un butin de près de 4 000 €. Présents lors du braquage, clients et employés du magasin ont été choqués. Certains ont été conduits à l'hôpital de Beauvais. Les gendarmes de Breteuil et de Beauvais sont chargés de l’enquête. L’identité criminelle s’est rendue sur place dans la matinée.",Breteuil,60120,4340
La Provence,2019-02-18,Avignon : braquage au Petit Casino de Saint-Ruf,"-Dimanche vers 7 heures, un homme est entré armé à la supérette Petit Casino, avenue Saint-Ruf, et a fui avec le fond de caisse, en cette heure dominicale matinale. Nul n’a été blessé. Le braqueur est en fuite.",Avignon,84140,91921
Nord Littoral,2019-02-16,"Braquage au Narval : Il m’a dit qu’il allait tirer, alors je lui ai dit Bah tire !","Vendredi matin, la journée n’a pas commencé comme d’habitude pour les gérants du tabac Le Narval, rue Constant Cronie, quartier du Fort-Nieulay. Vers 8h10, alors qu’ils viennent d’ouvrir et ont peu de clients, un homme entre, cagoulé, et pointe un pistolet vers celui qui se trouve derrière la caisse. « Je lui ai dit qu’il n’y avait rien en caisse à cette heure-ci, 05s il m’a demandé d’ouvrir le tiroir quand même. Quand il a vu qu’il y avait trois pièces de cinquante centimes, il m’a fait aller à la caisse du PMU, tout en continuant à me tenir en joue ». Arrivé à la caisse du PMU, le gérant ouvre le tiroir et donne son contenu, 100 euros. Entre-temps, sa compagne, plus au fond de la boutique, se faufile dehors pour appeler à l’aide, pendant que le malfaiteur est occupé. Elle raconte la suite: « Il m’a suivie dehors et il m’a demandé de rentrer, 05s j’ai refusé. Je lui ai demandé «Tu vas faire quoi ?« Il m’a répondu qu’il allait tirer, alors je lui ai dit «bah, tire !« Il m’a répondu qu’il reviendrait, et puis il est parti sans courir, en direction des blocs. » D’après la description des gérants, tous deux indemnes, l’individu était grand et 05gre, habillé en noir, avec une cagoule ne laissant voir que les yeux et la bouche. 04ès les faits, la police nationale est venue, à la recherche d’éventuels indices, notamment des empreintes, 05s d’après les témoins, l’individu portait des gants. Le magasin ne dispose pas non plus de vidéosurveillance.",Calais,62100,73911
L'Est éclair,2019-02-16,Tentative de braquage à l’Intermarché des Marots à Troyes,"Samedi vers 5 h, le premier employé de l’Intermarché des Marots arrivé au travail a été accueilli par trois hommes cagoulés et armés. L'ayant menacé d'une arme de poing, ils lui ont ordonné de les mener à la salle du coffre-fort. Comme il n'avait pas la clé du coffre et que d’autres employés arrivaient, les trois hommes ont fui. L’enquête est confiée au SRPJ de Reims. Dans la journée, l’exploitation des vidéos et les auditions des témoins avaient eu lieu. Samedi soir, nul suspect n'était interpellé. Le magasin, lui, fonctionne normalement.",Troyes,10000,61652
RTL,2019-02-15,Seine-et-Marne : une pharmacienne arrête elle-même son braqueur,"-Egreville, calme commune de Seine-et-Marne, un homme rafle la caisse d'une pharmacie. La patronne étant dans l'arrière-boutique. Avertie par un employé, la pharmacienne pourchasse le malfaiteur. ""Je suis partie comme une fusée"", dit-elle. Elle aperçoit le fugitif sur une place de la ville, et hurle. Avec une automobiliste qui suit le braqueur, elle le ""coince"" dans une impasse, où l'homme est ""ceinturé"" par une riveraine ""qui promenait son chien"". Les trois femmes lui ont ""fait les poches"", retrouvant une centaine d'euros.",Seine-et-Marne,77000,1373029
Nord Littoral,2019-02-15,Braquage à 05n armée au tabac Le Narval,"-Vendredi matin, le Narval, quartier du Fort Nieulay, s’est fait braquer par un individu peu après l’ouverture, vers 8h10. Celui-ci a forcé les deux gérants à lui donner les 100 euros de la caisse PMU et a fui. Les gérants n’ont pas été blessés, une enquête est ouverte.",Calais,62100,73911
LP,2019-02-14,"Bourg-la-Reine : braquage à la supérette, un ado de 16 ans en garde à vue","À cinq, ils ont braqué une supérette, rue Jean-Mermoz à Bourg-la-Reine, mercredi soir. Vers 21h15, un malfaiteur cagoulé a surgi devant le gérant, avec une arme de poing. Menacé, le commerçant a quitté sa caisse. Trois complices cagoulés se sont alors rués derrière la caisse pour voler une douzaine de bouteilles d’alcool. Et environ 200 € dans la caisse. Tous sont repartis avec le 5e bandit, qui guettait dehors. Plus tard, des policiers en patrouille ont arrêté un suspect, signalé sur les ondes. Ce garçon de 16 ans est en garde à vue.",Bourg-la-Reine,92340,20667
L'Est républicain,2019-02-14,Belfort : braquage au tabac presse Le Kennedy pour 300 euros,"Le tabac Le Kennedy, quartier des Résidences à Belfort, a subi vol à 05n armée, ce 14 février. Le braquage s’est déroulé peu après la fermeture, le gérant étant seul. Deux individus, visage caché, ont surgi dans le local. L’un a menacé le buraliste d'une arme de poing et a exigé la caisse. Ils ont raflé le butin, environ 300 euros, puis ont fui dans une voiture rouge que conduisait un troisième homme. 05s les actes des suspects ont été captés par des caméras de vidéosurveillance proches. Images de suite basculées à la salle de commandement du commissariat. Qui a aussitôt déployé les patrouilles disponibles, vite arrivées aux Résidences. Dans leur fuite, les suspects sont tombés sur la BAC 05s ont réussi à fuir, laissant leur véhicule vers la place de l’Europe. Jeudi soir, la sûreté urbaine et la police scientifique ont procédé aux constatations et enregistré la déposition du buraliste. Le commissariat reste discret sur les progrès de l'enquête. Le 7 09 2018 , le Kennedy avait déjà subi une tentative de braquage. Vers 7 h 15, des hommes portant des masques Scream avaient lui pointé une arme de poing à la tête de l’employé, exigeant qu’il ouvre le coffre-fort, vide. Puis la caisse, elle aussi vide. Dépités, les pieds nickelés avaient fui en courant vers la rue Saussot.",Belfort,90000,47656
LP,2019-12-04,Creteil : braquage à 200 000 euros chez les pros de l’optique,"-Le 29 novembre à Créteil, entre 18 heures et 19 heures, des malfaiteurs ont ciblé la société japonaise Nidek, qui développe, fabrique et distribue du matériel high-Tech pour la vision (ophtalmologistes, opticiens et orthoptistes). Préjudice : près de 200 000 euros. Sur place, il ne reste qu'un des directeurs, dans le bâtiment du stock et des ateliers, près du siège l'entreprise, rue Auguste-Perret.Soudain, des braqueurs surgissent, armés et cagoulé. Ils menacent le directeur, prennent les clés de la société, vont au dépôt des marchandises, ligotent leur victime et l'enferment aux toilettes. « Ils semblaient bien savoir ce qu'ils venaient chercher », dit un salarié. Entrés avec un badge, les voleurs volent six palettes de marchandises conditionnées, dont six meuleuses destinées aux opticiens, bijoux de technologie dont le prix atteint des milliers d'euros. D'où un préjudice très important. Chez Nidek, le personnel se dit « sous le choc ». L'enquête est confiée au SDPJ du Val-de-Marne. Les malfaiteurs sont toujours en fuite.",Créteil,94000,90605
L'Est républicain,2019-02-12,Besançon : braquage à 05n armée avorté au bureau de tabac Le Joker,"Récemment, des commerces bisontins ont subi des vols à 05n armée ou effractions. Lundi soir, le tabac Le Joker, 1 rue Tristan Bernard à Besançon, subit une tentative de braquage avortée. Suite à l'histoire du Totem, rue de Belfort, trois mineurs sont arrêtés. « Mon frère fer05t la porte quand il a vu deux hommes cagoulés arriver avec un pistolet », dit le gérant du tabac, « bon réflexe : il a tourné la clé dans la serrure et tiré le volet de sécurité ». « Tout est allé vite. Il est choqué, 05s on l'aidera à passer le cap. » La scène a été filmée par les caméras de surveillance du commerce.L’enquête est confiée à l’antenne de PJ de Besançon. Selon le parquet, nulle interpellation mardi soir. Le mode opératoire ressemble au braquage récent qui a touché le tabac de Pirey, rue des Lavoirs. C’est aussi munis d’une arme que des individus ont menacé l’employé, cette fois avec succès, avant de fuir avec la caisse. Le préjudice n'a pas été dévoilé.",Besançon,25000,115934
LP 9,2019-02-12,Gennevilliers : tentative de braquage du tabac-presse,"-Vendredi, vers 19h30, le tabac de la rue Henri-Barbusse à Gennevilliers a été la cible d’un jeune braqueur armé d’un pistolet, visage caché sous un casque de moto. « Il est entré et il a crié : Passe-moi la caisse en braquant mon mari », dit la gérante. Sur la vidéosurveillance on voit le braqueur garer son deux-roues devant le tabac, hésiter et faire les cent pas. « Il y avait 4 ou 5 clients. Il a attendu leur départ ». Le braqueur entre « quand il ne restait plus qu’un seul client. » Son mari n’a pas paniqué. « 05s quelle caisse ? » répond-il au braqueur. La scène dure peu de temps. Le voleur prend à partie le dernier client, redemande la caisse, le gérant ne bouge toujours pas. Le braqueur, « pas plus que 16, 17 ans », estiment les commerçants, a filé bredouille sur son scooter. Ce samedi, le gérant est allé porter plainte. C’est la 1e fois que le tabac, ouvert il y a 3 ans, subit une tentative de vol à 05n armée.",Gennevilliers,92230,46907
Courrier Picard,2019-02-08,Braquage à Clermont: «Il faut être dérangé pour agir ainsi»,"-(...) Hier, le procureur de Beauvais reconnaissait que l’individu « avait des antécédents psychiatriques importants ». Sans en préciser la nature. Le braqueur a été hospitalisé plusieurs fois. Chose certaine, il vivait à Clermont. À ce jour, « il n’a pas de famille identifiée », si ce n’est une mère et un beau-père. Il ne travaillait pas. Du fait du secret de l’instruction, la direction du CHI, l’hôpital psychiatrique de Clermont/Fitz-James, dit avoir été sollicitée par le procureur pour les besoins de l’enquête.",Clermont,60600,10147
LP,2019-02-08,Oise : le braqueur abattu par les gendarmes était suivi en psychiatrie,"-L'hypothèse tournait dans toutes les têtes, après le braquage avorté de la Banque populaire, jeudi rue de la République. Abattu par les gendarmes, le braqueur était un ancien patient du centre hospitalier (CHI) de Clermont, spécialisé en soins psychiatriques. Information confirmée vendredi par le procureur de Beauvais. Dans les poches du braqueur, les enquêteurs ont en effet trouvé des médicaments prescrits contre la schizophrénie. « Selon sa famille, sa dernière hospitalisation remonte à 2018, en Belgique. » L’homme de 47 ans, qui avait menacé les militaires d’un couteau après avoir pris en otage une employée, arme sur la gorge, était issu de l’Oise. Il habitait Clermont et n’avait pas d’antécédents judiciaires.",Clermont,60600,10147
LP,2019-02-07,Oise : un braqueur preneur d’otage abattu par les gendarmes à Clermont,"-Le braqueur ne sera ja05s sorti de la banque. Jeudi, fin de matinée, un homme de 47 ans a été abattu par les gendarmes après avoir voulu braquer la Banque populaire de Clermont, rue de la République au centre-ville. « Tout s’est passé très vite, indique le procureur de Beauvais, sur place. L’homme est entré dans la banque et a menacé les employés avec un couteau. Ils ont déclenché l’alarme d'où, l’intervention de la gendarmerie de Clermont. » Sur place, les militaires font face un homme menaçant, qui prend en otage une employée, « lui mettant le couteau sous la gorge ». Arme en 05n, le braqueur se rue sur les gendarmes. Ces derniers font feu « plusieurs fois, vers ses membres supérieurs et inférieurs ». Puis les secours tentent de le réanimer, en vain. Choquée, blessée à la 05n, l’otage a été conduite à l’hôpital. Remise de ses émotions, elle sera entendue par les gendarmes. Si l’identité de l’homme est en cours vérification, il s’agirait d’un habitant de Clermont inconnu de la police.",Clermont,60600,10147
JMM,2019-02-07,Un braqueur armé d'un couteau prend plusieurs personnes en otages dans une banque à Clermont dans l'Oise et L'homme abattu par les gendarmes,"Muni d'un couteau, un homme a voulu braquer la Banque populaire de Clermont (Oise) aujourd'hui, fin de matinée. Les gendarmes ont usé de leur arme, l'homme menaçant les employés et les forces de l'ordre. Habitant Clermont, le braqueur quadragénaire décédé était inconnu des autorités. ""Il est d'abord entré à la banque et a menacé les employés avec son arme"" dit le procureur de Beauvais, sur place. Toujours selon lui, un employé aurait déclenché l'alarme quand le braqueur est entré, ce qui a permis l'intervention rapide des forces de l'ordre. Lors du braquage, sept clients se trouvaient dans la banque et une employée a été prise en otage ""avec un couteau sous la gorge"". C'est alors qu'il a menacé les gendarmes, qui l'ont neutralisé.",Clermont,60600,10147
LP,2019-02-05,Evry-Courcouronnes : un braquage déjoué par la force Sentinelle chez Franprix,"Un braqueur de 31 ans a ciblé le commerce où se trouvaient les militaires. Vers 13 heures ce 14 février, il surgit au Franprix, rue Paul-Claudel à Evry. Cagoulé, il brandit une arme de poing vers l’employé et exige la caisse. Pas de chance, les militaires de Sentinelle sont dans les rayons au même moment… Voyant les hommes en kaki aller vers lui, le malfrat veut fuir puis les menace d’une matraque. Les militaires le désarment, le plaquent au sol et l’entravent. Le SDF de 31 ans est gardé à vue à la sûreté, en charge de l’enquête. Son arme était fausse.",Evry-Courcouronnes,91000,67967
La Dépêche,2019-02-05,La jeune vendeuse de la boulangerie raconte le braquage dont elle a été victime lundi soir,"La boulangerie « Le Saint-Jean », place Saint-Jean à Casseneuil, Lot-et-Garonne, a subi un braquage lundi vers 19 heures. Un homme cagoulé, muni d’un fusil à canon scié a surgi au commerce, entre deux clients et réclamé la caisse contenant environ 500 euros à Stéphanie, l’une des vendeuses. Elle raconte l’intrusion d’un homme dans la boutique, vers 19 heures : des clients entraient et sortaient sans arrêt. Le bandit portait une cagoule et un fusil. Il m’a dit « Donne-moi la caisse. » J’ai dit non deux fois, puis il a sauté sur le comptoir, mis l’écran de la caisse par terre. Là, j’ai cédé, 05s ne l’ai pas quitté des yeux lors du braquage. Stéphanie ouvre le tiroir-caisse, prend le monnayeur que le braqueur lui arrache pour le fourrer dans un sac avec les billets.«Il y avait de 500 à 600 euros », dit la propriétaire. « Il a braqué une mère de famille pour 500 euros.. Elle a eu raison de lui remettre la caisse, il n’y a pas de discussions"", tranche la commerçante, originaire de Bergues dans le Nord ""Si ça avait été moi, j’aurais sans doute refusé de lui donner, en me rebellant. On travaille toute la se05ne, sans vacances, je me lève à 3h30 pour la boulangerie, payer mes salariés, on s’endette, on trime et un type vient vous braquer pour 500 euros ? Pour mon mari il était exclu de fermer mardi, ça aurait été céder. On est là, il faut qu’on bosse, on continue.?»Le vol a duré «deux minutes, 05s à moi ça semble une éternité», souffle Stéphanie. « Le braqueur sort, croise un client habituel, qui me demande si ça va, je réponds non, je viens de me faire braquer. Là je m’effondre. Le client vient m’aider et une autre cliente arrive et appelle les gendarmes.» Le voleur lui, fuit dans la voiture d’un complice qui l’attend sur le pont de la Lède, tout près. Le véhicule est arrivé de la D133, la route de Saint-Pastour un peu plus tôt, a contourné le rond-point devant la boulangerie, déposé le braqueur et attendu son retour, au milieu de la chaussée, bloquant la circulation, portière ouverte.",Saint-Jean,31240,10694
France Bleu- Loire,2019-02-01,Un restaurateur de Saint-Étienne met en fuite deux braqueurs,"Jeudi à 22 heures, deux braqueurs ont surgi dans un restaurant, rue des Docteurs-Charcot à Saint-Étienne, que le gérant fer05t, et le menacent d'un pistolet. Des clients et les employés sont présents. Les malfaiteurs sont masqués, 05s le restaurateur scrute leur pistolet, sans doute factice. Il assène un coup à l'un des deux braqueurs et les deux malfaiteurs fuient.",Saint-Etienne,42000,172565
Haute-Provence Info,2019-02-01,Manosque : Braquage à 05n armée dans un magasin de téléphonie,"-Ce vendredi 1er février, vers 19h30, l'enseigne Phonéo de Manosque, au bas de l'avenue Jean Giono, a été victime d'un braquage à 05n armée. Deux hommes, cagoulés et armés, ont surgi au magasin en braquant le gérant du commerce et lui demandant la caisse et des téléphones. Devant son refus, ils l'ont frappé d'au moins un coup de crosse au visage. L'homme s'est débattu et a pu les faire fuir. Le gérant du commerce, légèrement blessé, a été secouru par les pompiers de Manosque qui l'ont transporté à l'hôpital.",Manosque,4100,22333
Le Bien Public,2019-03-31,Bligny-sur-Ouche : braquage au bureau de tabac... pour 170 €,"Samedi vers 7 heures, un homme armé est entré au bureau de tabac de Bligny-sur-Ouche, près de la place de l’Hôtel-de-Ville. Avec une arme de poing, type revolver Far West, il aurait menacé une employée, présente à l’ouverture de la boutique, avant de voler le fonds de caisse, 170 €. Il aurait ensuite fui par la rue principale. Les gendarmes de Beaune enquêtent et cherchent le suspect.",Bligny-sur-Ouche,21360,831
LP,2019-03-30,03eille : Le gérant d’un PMU victime d’un violent braquage pour 500 €,"-Violent braquage vendredi vers 7 heures du matin, à l’ouverture du rideau, dans les quartiers Nord de 03eille. Deux individus cagoulés, gantés et armés ont attaqué un PMU du quartier des Flammants dans le 14e arrdt. Les agresseurs, munis d’une arme de poing et d’une batte de baseball, ont tabassé le gérant du PMU. Le sexagénaire, a dû donner son fond de caisse sous les coups de crosse et de batte. Les deux braqueurs ont fui avec 500 euros et quelques cartouches de cigarettes.",03eille,13000,855393
Sud-Ouest,2019-03-28,Arcachon : braquage dans une boutique du centre ville,"04ès le braquage par un homme de 33 ans du kiosque de la gare de Gujan-Mestras il y a quelques jours, une boutique du centre, près de la place des Marquises, a été ciblée par des voleurs. Dimanche vers 18h45 le carnaval d’Arcachon étant fini, deux individus cagoulés ont surgi à la boutique de vêtements Napapijri. L’un a visé la vendeuse d'une arme de poing et l'a tirée de force dans un coin de la boutique pendant que l’autre vidait la caisse (environ 300 euros). Les deux hommes ont ensuite fui en courant dans Arcachon. La salariée est encore sous le choc du braquage. La police est vite intervenue. L’enquête est confiée à la PJ de Bordeaux",Arcachon,33120,11284
