LP ,2018-09-16,03eille : ils ratent leur braquage et se font tabasser par les jeunes du quartier,"Braquage samedi au marché aux puces de 03eille 15e. Arrivés vers 20h. au Lidl du marché aux puces dans une BMW a fausses plaques, les deux braqueurs, ont raflé trois fonds de caisse, sous la menace d'un fusil à pompe et d'un pistolet, dit la DDSP. Ensuite, ils ont contraint un caissier à leur ouvrir le coffre, vidant son contenu dans plusieurs sacs. Chargeant le butin dans leur voiture, les deux braqueurs ont été happés par des gens du cru, une cinquantaine dit la DDSP. Voulant de se libérer de l’échauffourée, les braqueurs ont tiré au sol, avec un blessé par un petit plomb à une jambe, deux autres écorchés par des éclats, et « un papy » touché d’un coup de crosse à la tête. Le plus atteint est le braqueur interpellé par les policiers. Déjà connu pour vol, il était tabassé et s’est fait rouler dessus par son complice qui a fui ». Le butin, 15 000 euros s’est volatilisé dans les poches des riverains: « tout le monde s’est servi », dit la police.",03eille,13000,855393
La Provence,2018-09-16,Le braquage au magasin Lidl à 03eille tourne mal : sept blessés,"Hier, des vendeurs de cigarettes ont voulu empêcher la fuite des deux braqueurs du Lidl de Cap-Janet (03eille 15e) avant la fermeture. Vers 20 h, lles vendeurs ont vu deux hommes armés surgir au magasin et se sont interposés. Les braqueurs avaient raflé trois fonds de caisse et le contenu d'un coffre. L'un des malfaiteurs, lynché, a tiré plusieurs fois, éraflant trois jeunes hommes aux 05ns et aux jambes. Un autre jeune a pris des coups de crosse, deux femmes sont choquées. Sept victimes soignées par les pompiers, sans gravité. Les constatations faites par la police scientifique, un périmètre de sécurité a été installé et les témoins, entendus. Le braqueur blessé est gardé à vue, son complice a fui en voiture, La PJ enquête. Les braqueurs étaient munis d'une arme de poing et d'une arme longue. Voici un mois, un braquage était advenu au même marché aux puces.",03eille,13000,855393
Le Progrès,2018-09-15,Vaulx-en-Velin : braquage à 05n armée dans une boulangerie,"-Une boulangerie de la rue Victor-Hugo à Vaulx-en-Velin a été braquée vendredi vers 19 heures. Quatre hommes sont arrivés en voiture. Trois en sont sortis cagoulés et gantés. Deux guettant à la porte, le dernier, muni d’un type de pistolet automatique, y pénétrait. Effrayé, l’employé s’est caché dans l’arrière-boutique, le braqueur raflant la caisse. Nul client à ce moment-là. Les fugitifs ont fui dans le même véhicule, introuvable dans la soirée. Nul n’a été blessé. Le préjudice reste à évaluer.",Vaulx-en-Velin,69120,49658
Alpes1,2018-09-14,Braquage d’un tabac-presse à Meylan,"-Jeudi, vers 6h30 du matin, dans un tabac, av. de la Plaine-Fleurie à Meylan. Un homme, cagoulé et armé a surgi au commerce et a raflé un peu plus de 100 euros. Il a alors fui en tirant un coup de feu en l’air. Les gendarmes ont ouvert une enquête.",Meylan,38240,17129
Le Patriote Beaujolais,2018-09-14,Villefranche : un braquage à 05n armée au bureau de tabac le Savigny,"-Le gérant du tabac le Savigny, 620 rue Jean-Michel-Savigny à Villefranche, a vu ce matin vers 7h20, deux individus munis d'une bombe lacrymogène et d'un couteau surgir dans son bar. ""Il ont usé de la bombe et l'ont menacé du couteau, pour rafler le fond de caisse. Préjudice, 400 euros"", dit la police. Grâce à la vidéo-surveillance, les policiers ont arrêté l'un des deux auteurs âgé de 15 ans. ""Il a été trouvé peu après, avec une part du butin et la bombe lacrymo."" Gardé à vue, il sera présenté au Parquet de Villefranche pour une probable mise en examen.",Villefranche,89120,606
Sud-Ouest,2018-09-13,Dordogne : tentative de braquage à Coursac,"Ce jeudi, vers 16h-16h15, un homme a tenté de braquer le tabac sis route des Privats, à Coursac (Dordogne). L’homme a fui, laissant toutefois son véhicule sur place. L’identification criminelle et les gendarmes de Périgueux sont restés un long moment sur le parvis du commerce, pour réaliser les premières constatations et d’entendre victimes et témoins.",Coursac,24430,2149
Corse-Matin,2018-09-13,Braquage d’un commerçant à L’Ile Rousse,"-Deux individus ont braqué cette nuit vers 1h le gérant d’un commerce à L’Ile-Rousse alors qu’il regagnait son domicile. Ils ont exigé la recette du commerce sous la menace de leur arme. Une enquête est en cours, confiée à la gendarmerie.",L'ile Rousse,20220,3424
LP,2018-09-13,Braquage à la Poste de Châtenay-Malabry,"Un homme seul, masqué, a braqué une poste de Châtenay-Malabry. Jeudi vers 15 heures, il a surgi, arme au poing, dans cette agence du rez-de-chaussée d’un petit immeuble d’habitation, av. Francis-de-Pressensé. Il a menacé le personnel pour rafler quelque 600 €. La PJ-92 enquête.",Châtenay-Malabry,92290,33286
Ouest-France ,2018-09-13,"Bois-de-Cené. Braquage du camping, les auteurs arrêtés","Les trois braqueurs du camping de Bois-de-Cené ont été arrêtés mercredi après-midi, sur le parking d’un supermarché à Machecoul (Loire-Atlantique). Un hélicoptère de la gendarmerie a repéré la Volvo grise dans laquelle les braqueurs s’étaient enfuis. Mercredi, fin de matinée, deux hommes font irruption à l’accueil du camping. « avec une barre métallique de type démonte-pneu», dit le vice-procureur des Sables-d’Olonne. Les deux originaires de Nantes, aux casiers judiciaires remplis, « 23 condamnations pour l’un, 25 pour l’autre» exigent alors la caisse. « La gérante leur dit qu’elle était vide. Ils sont repartis.» Vendredi à 11h, les deux hommes passeront en comparution immédiate au tribunal des Sables-d’Olonne. Nulle charge contre le 3e individu présent lors de l’arrestation.",Machecoul,44270,6268
Le Dauphiné,2018-09-12,Braquages à Châtillon-Saint-Jean et Romans : un suspect interpellé,"-Samedi, à la mi-journée et en moins de 15 minutes, deux commerces, un tabac à Châtillon-Saint-Jean et un salon de coiffure à Romans-sur-Isère, étaient ciblés par un braqueur. Avec une bombe lacrymogène, le malfaiteur a volé 150 euros à Châtillon-Saint-Jean. Face à la résistance de la coiffeuse romanaise, il avait fui sans butin. Les deux dossiers ont été joints, et l'enquête confiée aux gendarmes de Romans. Poussant leurs investigations, les enquêteurs ont interpellé un suspect ce matin. Âgé d’une trentaine d’années, il a été mis en garde à vue. Les investigations se poursuivent.",Châtillon-Saint-Jean,26750,1359
La Dépêche,2018-09-11,Braquage au pistolet à la pizzeria,"Un employé de la pizzeria Monsieur Tomate, 39 av. Saint-Exupéry à Gaillac a été braqué par deux individus dimanche vers 22h30 alors qu'il sortait avec la recette du jour, plusieurs centaines d'euros. Ce allait vers sa voiture eta été abordé par deux hommes masqués, munis d'un pistolet automatique. Le pizzaïolo allait déposer la recette dans une agence bancaire quand les agresseurs ont exigé l'argent. Leur arme de poing était peut-être factice. L'homme a remis la recette sans violence, choqué 05s indemne. Les braqueurs qui ont fui. L'enquête est confiée aux gendarmes de Gaillac.",Saint-Exupéry,33190,168
France 3 Picardie,2018-09-11,Un homme arrêté à Flixecourt alors qu'il venait de commettre un braquage,"-Ce matin à Flixecourt, Somme, les gendarmes ont interpellé en pleine rue un homme venant de braquer une banque de la commune. Ila été arrêté en sortant de Caisse d’Epargne locale. Interpellé sans dommages avec de l'argent, l'homme était muni d'une arme de poing, sans doute à plomb. Le malfaiteur n'a fait aucun blessé, le personnel et les clients de l'agence sont choqués. L’homme est en garde à vue. L'enquête a été confiée à la brigade de recherche d'Amiens.",Flixecourt,80420,3173
Le Dauphiné,8-09-10,"Romans-sur-Isère : il veut braquer un salon, la coiffeuse se défend","«Il était 12 h 40 samedi » Les témoins sont précis. Deux hommes cagoulés d’un bas nylon ont tenté de braquer le salon de coiffure “Za bou”. Huit ans que ce commerce est ouvert sur l’avenue Jean-Moulin, à Romans-sur-Isère. Le voisin patron d'auto-école, a confié : « Ce n’est pas rassurant… » Le commerçant est installé dans cette rue depuis plus de dix ans. Il a dit que les malfaiteurs étaient arrivés en voiture. L’un attendant au volant, l’autre pénétrant le salon en plein jour, la gérante et son employée étant présentes. Le braqueur les a aspergés de lacrymogène. 05s la gérante l’a repoussé et gazé à son tour. Riposte qui a permis de faire fuir l’homme masqué qui est reparti sans butin. L’enquête est menée par la police de Romans.",Romans-sur-Isère,26100,33160
France3 Hauts-de-France,2018-09-10,Braquage à l'agence de la Société Générale de Cuise-la-Motte près de Compiègne,"-Dans la nuit de dimanche, entre 2h30 et 3h, des malfaiteurs ont braqué la Société Générale de Cuise-la-Motte, Oise. Selon l'enquête, les braqueurs ont injecté un gaz dans l'agence puis l'ont fait exploser. Le souffle a éventré le rez-de-chaussée de l'agence. Ils ont fui avec de l'argent, montant inconnu. Le dispositif de contrôle est inaccessible : un mur pourrait s'effondrer. Les locataires du logement au dessus de l'agence ont donné l'alerte. Ce couple et son enfant de 10 ans ont eu très peur, dit le 05re de la commune. Un suivi psychologique est prévu. Les dégâts sont tels qu'il a pris un arrêté interdisant l'accès aux lieux. Les locataires sont relogés par la 05rie. ""C'est la première fois que je vis un événement comme ça, dit le 05re. L'explosion a été entendue à 300 mètres.""",Cuise-la-Motte,60350,2192
Evasion FM,2018-09-10,Braquage dans un magasin de Torcy,"Nouveau braquage en Seine-et-Marne hier matin au Franprix de Torcy. Trois hommes sont entrés, armés d'un fusil à pompe à l'ouverture. Le gérant a été visé sur la nuque, Les trois individus ont fui avec la caisse. Une enquête est en cours.",Torcy,77200,22568
Normandie-Actu,2018-09-09,Braquage d’un magasin Aldi à Évreux : quatre individus activement recherchés,"-Quatre individus sont recherchés suite au braquage du Aldi à Évreux (Eure), rue Jacques-Monod, le 8 09, à la fermeture du magasin vers 20h30. Les braqueurs cagoulés ont attendu la fermeture pour agir. Selon un témoin entendu par le SRPJ de Rouen chargé de l’enquête : Des individus ont profité de la sortie d’une caissière du Aldi d'Évreux pour bloquer la porte du personnel et entrer au magasin. Ils auraient, dit ce témoin, braqué le gérant à l'arme de poing, qui leur a remis la recette. Deux autres salariés étaient dans le magasin. Les individus ont alors fui et sont recherchés par la police. Le préjudice est ignoré.",Evreux,27000,47733
LP,2018-09-09,Torcy : le magasin Franprix braqué par trois malfaiteurs,"Le Franprix, passage de la Mogotte, à Torcy, a été braqué dimanche. Vers 9 heures, à l’ouverture, trois malfaiteurs cagoulés ont attaqué le gérant, qui a eu un fusil à pompe braqué sur la nuque. Le trio a fui avec la caisse. La PJ de Meaux enquête. Ce Franprix avait déjà été braqué en 06 dernier.",Torcy,77200,22568
20 Minutes,2018-09-09,"Drôme: Le braqueur s’en prend à une coiffeuse, elle riposte en l’aspergeant de gaz lacrymogène","Un collant en nylon comme masque, un complice planqué hors de la boutique. Samedi midi, un homme a surgi chez une coiffeuse du centre de Romans-sur-Isère, Drôme, espérant rafler sa caisse. Le braqueur a usé de gaz lacrymogène sur la gérante et son employée, présentes lors du vol. 05s face à la menace, la coiffeuse a repoussé le voleur puis l’a aspergé de gaz lacrymogène, parvenant à le faire fuir. La police de Romans enquête pour retrouver le voleur masqué parti bredouille.",Romans-sur-Isère,26100,33160
L'Écho Républicain,2018-07-09,Un otage désarme le braqueur du Trésor public,"-Des dizaines de milliers d’euros rangés au coffre-fort ont échappé à un braqueur qui a surgi, hier vers midi, au Trésor public de Lucé. Il avait garé sa Kangoo rue d’Aquitaine, près de l’agence des Finances publiques, rue de Quercy, à côté du centre commercial Géant Casino. L’homme a profité du passage d’une employée pour la menacer d'une arme de poing. Elle a dû le laisser entrer. Il y avait une vingtaine d’employés à l’intérieur. Le braqueur les a confinés aux toilettes. Puis il a été à salle du coffre-fort avec deux otages, un caissier et l’employée interceptée à la sortie. Le coffre-fort aurait été ouvert. 05s le braquage échoue là, dit le procureur : « Le caissier voit qu’il s’agit d’une arme factice. Il désarme l’agresseur, qui riposte en le frappant à la tête d'une cale en bois. L'arrivée d’un autre salarié, sorti des toilettes, permet de maîtriser l’agresseur ». Les policiers arrêtent le braqueur. Le caissier de 43 ans blessé au crâne, est hospitalisé. Le suspect, un Chartrain de 50 ans, est gardé à vue pour vol avec arme, à la sûreté départementale. Il aurait déjà commis trois braquages et fait huit ans de prison.",Lucé,28110,15404
Objectif Gard,2018-09-07,Braquage d’une épicerie : 100 euros dérobés et un individu en fuite,"-Une épicerie située de la commune de Robiac-Rochessadoule, village au nord d'Alès, a été braquée. Un homme seul, cagoulé et armé, a surgi au magasin, jeudi vers 16h20. Il a raflé la caisse, près de 100 euros, puis a fui à pied. Vite, 20 gendarmes sont arrivés, avec un hélicoptère de Montpellier. Si le malfaiteur, introuvable, est recherché par les gendarmes d'Alès chargés des investigations.",Robiac-Rochessadoule,30160,840
Le Dauphiné,2018-09-07,4e braquage en trois se05nes à Annecy à l'hôtel Zenitude de Seynod,"-04ès le restaurant Burger King le 20 08, l'hôtel Ibis Budget le 22 08 et le magasin Biocoop le 30 08 dernier, braqués ces dernières se05nes, nouveau vol à 05n armée cette fois en zone gendarmerie à Seynod le 5 09. L'Hôtel-Résidence Zenitude, sur les hauts de la commune a été visé. L'enquête a été confiée à la gendarmerie. Deux individus munis d'armes de poing auraient surgi, masqué, et exigé la caisse. Scénario similaire au braquage de Ibis Budget, le 22 08 dernier. Etudiant la piste de vols à 05n armée commis par une même équipe, les forces de l'ordre ont alerté commerçants, restaurateurs et hôteliers. C'est le quatrième dans la ville depuis le 20 08 dernier.",Annecy,74000,126924
La Montagne,2018-09-07,Le principal suspect du braquage de Darnets (Corrèze) interpellé,"La gendarmerie de Corrèze a capturé le 29 08 à Ussel (Corrèze), le principal auteur du vol à 05n armée du 2 08 dernier à Darnets. Ce soir-là, deux hommes avaient surgi chez un particulier. Ligoté, avec un ami alors présent, il devait dire aux agresseurs où était le coffre-fort. Les individus avaient fui avec un millier d'euros. L'arrestation récente fait suite à trois autres, du 16 08, aussi à Ussel, par la gendarmerie et le GIGN. Un 4e suspect, décrit comme dangereux et qui justifiait le recours au GIGN, s'était échappé et était depuis recherché. Ce quadragénaire au lourd passé judiciaire, les militaires l'ont arrêté dans le quartier de la gare d'Ussel. Les faits étant de nature criminelle, le parquet de Tulle est dessaisi au profit du parquet de Limoges. Les quatre braqueurs sont en détention provisoire.",Darnets,19300,361
L'Essor Savoyard,2018-09-07,"Bassin annécien: nouveau braquage, à Seynod cette fois","-Braquages multiples depuis 15 jours sur le bassin annécien. Le 5 09 2018, entre 7 h. et 8h, un nouveau fait s’est produit à Seynod. Deux hommes masqués ont surgi dans l’hôtel-résidence Zenitude, 16 rue du Champ de la Taillée. Munis d’armes de poing, ils ont raflé la caisse, un millier d’euros. Cinquième braquage sur le bassin annécien depuis le 20 08, deux avant à Cran-Gevrier, à l'Ibis Budget et au Burger King, deux à Annecy, au Biocoop et dans une boutique d'électricité. Pour les forces de l’ordre, il est trop tôt pour rapprocher tous ces faits, même si les modus operandi sont proches. Renforçant leur présence de terrain, d'abord à l’heure de l’ouverture-fermeture des commerces, police et gendarmerie rappellent les acteurs économiques à la vigilance.",Seynod,74600,21213
France Bleu Belfort-Montbéliard,2018-09-07,Le Tabac le Kennedy à Belfort visé par une tentative de braquage,-Le Tabac le Kennedy à Belfort a subi une tentative de braquage vendredi vers 7 heures juste à l'ouverture. Deux hommes masqués et armés ont surgi au le commerce et menacé l'employé. Ils cherchaient de l'argent 05s les caisses étaient vides. Ils ont fui en courant. Une enquête est ouverte pour les retrouver. Nul n'a été blessé lors de cette tentative de braquage avortée.,Belfort,90000,47656
L'Est républicain ,2018-09-07,Braquage express au tabac presse : les deux auteurs repartent bredouilles,"Le tabac Le Kennedy a fermé en début de matinée ce vendredi durant quelques instants, après une tentative de vol à 05n armée, alors que l’employé était seul dans ce local du 6 place Schuman à Belfort. Vers 7 h 15, deux hommes y font irruption. « Leur visage était caché et ils étaient munis d’arme de poing », dit le sexagénaire. « J’ai compris ce qui allait se passer. ». L’un des suspects saute par-dessus le comptoir et son complice interdit toute fuite à l’employé. Ils le menacent de leur arme. « Ils voulaient que j’ouvre le coffre », dit-il. « Je leur ai dit qu’il était vide. Ils ne m’ont pas cru. L’un d’eux a pointé son arme contre ma tête. »L’employé ouvre le coffre-fort. Vide. Dépités, les deux suspects hésitent puis exigent la caisse. « Là encore », dit l’employé, « je leur ai dit que la caisse était vide à l’ouverture. » Bredouilles, les deux hommes fuient en courant, sur le bd. Kennedy puis rue Saussot, croisant une Belfortaine promenant son chien. Peu après, des patrouilles arrivent tabac, puis la Sûreté urbaine et un technicien en police technique et scientifique. Le travail de recherches, d’investigations et recueils de témoignages se poursuit. Plainte a été déposée. Cette tentative de braquage à gros risques, arrive trois se05nes après le vol à 05n armée d’Aldi, non loin du tabac. Le 11 08, trois hommes avaient raflé deux caisses, préjudice quelques milliers d’euros. Il est encore trop tôt pour relier ces deux affaires.",Belfort,90000,47656
France Bleu Lorraine Nord,2018-09-06,Tentative de braquage à la voiture-bélier à l'hypermarché Cora de Metz-Borny,"Des malfaiteurs ont tenté de voler l'argent d'un distributeur de billets, dans la nuit de mercredi, dans la galerie de l'hypermarché Cora de Metz-Borny avec une voiture bélier. Ils sont repartis bredouilles. Vers 23h, dans la nuit de mercredi, la police a été alertée d'une tentative de braquage à l'hypermarché Cora de Metz-Technopôle, à Borny. Des malfaiteurs ont pénétré dans la galerie marchande après avoir défoncé la porte avec une voiture bélier. Ils ont arraché un DAB, 05s sont repartis bredouilles avant l'arrivée de la police. La voiture a été retrouvée incendiée à Coincy, à quatre km. de là. Les auteurs ne sont pas identifiés pour l'instant, la police les recherche.",Vers,74160,893
Le Pays d'Auge,2018-04-09,"Nouveau braquage à Lisieux : après une boulangerie, un tabac-presse","2e braquage à Lisieux en 4 jours. Une boulangerie le 31 08, un tabac braqué, le 3 09, dans le même schéma. Vers 18h45, près de la fermeture, un homme armé et cagoulé a surgi au magasin rue Pierre-Corneille, centre commercial du quartier de Hauteville. Il a pointé un pistolet sur le gérant et exigé la caisse. La police enquête.",Lisieux,14100,20318
LP,2018-09-04,Creil : braquage à 05n armée à la station Esso,"A 7 heures mardi, deux individus cagoulés ont surgi à la station Esso de Creil, route de Chantilly. L’un menace la caissière d'une arme de poing pour qu'elle ouvre le coffre. L’employée ne pouvant pas, les braqueurs raflent 200 € du fond de caisse et fuient à pied en vers Chantilly.« on suppose que ce sont des jeunes vu leur voix, 05s toutes les pistes sont ouvertes, dit le commissariat de Creil. L’exploitation des vidéos est en cours» Quelques heures après, le gérant de la station reste ému. « Il n’y a eu que des violences verbales. 05s s’en prendre à une femme… », expliquant n’avoir ja05s connu d’épisode similaire, l’homme envisage de renforcer la sécurité de la station-service.",Creil,60100,35657
Ouest-France,2018-09-04,Lisieux. Nouveau braquage de commerce : un tabac-presse attaqué,"-04ès le braquage d’une boulangerie (70€ le 31 08) un tabac du quartier d’Hauteville à Lisieux a subi un vol avec arme. Vers 18h45 le 3 09, à la fermeture comme au premier braquage, un homme cagoulé et armé a surgi au tabac rue Pierre-Corneille, centre commercial n° 1. Le malfaiteur a pointé son pistolet sur le gérant en exigeant la caisse. Une enquête est ouverte.",Lisieux,14100,20318
LP,2018-09-03,Bourg-la-Reine : braquage au Franprix,"-Le braqueur surgit au Franprix, bd.du Général-Leclerc, Bourg-la-Reine, vers 15h30 lundi, sous casque intégral, arme en 05n, il menace l’employée de caisse, qu’il gifle pour rafler quelques centaines d’euros et fuit en deux-roues. Le commissariat d’Antony enquête.",Bourg-la-Reine,92340,20667
France3Régions,2018-09-02,Annecy : les forces de l'ordre s'inquiètent d'une augmenta­tion des vols et braquages de commerces,"-Nombre inquiétant de vols et braquages les trois dernières se05nes d'08. Recrudescence des vols en tous genres visant les commerces de la région d'Annecy. Dans cette seule période, quatre braquages d'individus cagoulés-armés sont constatés. Le dernier, au Biocoop, rue du 11eBataillon de Chasseurs Alpins le 29 08. Les malfaiteurs agissent d'usage en fin de journée, ou à l'ouverture. Face au phénomène, policiers et gendarmes d'Annecy appellent à la vigilance. Les services de surveillance - notamment sur les créneaux horaires visés - ont été renforcés autours des centres et zones commerciaux, avec contact des commerçants pour les sensibiliser. Cela en uniforme ou en civil, en véhicules sérigraphiés comme banalisés.",Annecy,74000,126924
Ouest-France,2018-08-30,Une quinzaine de commerces braqués à Laval en dix ans- (48),"-Le Carrefour City, av. Robert-Buron, à Laval est braqué, dimanche matin 12 08. Les deux hommes cagoulés menacent le personnel d'une arme et enferment des clients dans une remise. Au moins deux clients sont aspergés de gaz lacrymogène. De l’argent a été volé. Avant cela, une quinzaine de commerces ont été braqués à Laval, en dix ans.",Laval,53000,49728
France Bleu Pays de Savoie,2018-10-31,Annecy : un braquage dans une station-service,"-A 20 heures mercredi, deux hommes ont braqué la station Agip, avenue de Chambéry à Annecy. Selon de premiers éléments, les deux individus étaient munis d’une arme poing. ""peut-être factice"", dit ce soir un enquêteur. Ils ont raflé 200 euros et ont fui.",Annecy,74000,126924
Europe1,2018-10-29,Bretagne : un patron de bar fait fuir ses braqueurs à 05ns nues,"Gildas Calvez, patron du tabac Gwell Mad à Douarnenez, a réussi à repousser une tentative de braquage dans son bar, le 26 octobre vers 23h30. Ce soir-là, le quinquagénaire repère deux individus capuchés d'environ 1,80 m avec des lunettes de soleil. ""Je les ai vus traverser la route. J'ai fait la réflexion à une dizaine de clients: 'Ils ne viennent pas chercher des cigarettes. Ceux-là, ils sont pour moi'"", a-t-il dit au lende05n des événements. À peine entrés, un des deux individus sort une arme à feu et l'a pointée sur sa tête. 05s du comptoir, Gildas Calvez a pu désarmer son assaillant. ""Je l'ai agrippé. Il a voulu se débattre et je lui ai dit : 'Reste là mon coco'"", dit-il. Face à cette réaction inattendue des braqueurs, le second complice, jusque-là en retrait, arrive et s'attaque à Gildas Calvez : ""Il m'a frappé le bras qui tenait son complice"", dit le commerçant. ""J'ai âché prise et ils ont fui en courant, les 05ns vides. Ça a duré une minute à peine. Depuis que j’ai pris le commerce en 2003, je n’avais ja05s vu ça"", dit Gildas Calvez. Une enquête est ouverte par les gendarmes, 05s les braqueurs courent toujours.",Bretagne,90130,265
LP 28,2018-10-18,Clichy : braquage au supermarché Leclerc,"A la fermeture du supermarché, vers 21 heures samedi, deux hommes masqués, 05ns gantées, ont surgi devant le personnel du Leclerc de Clichy, qui fer05t boutique. L’un des braqueurs aurait frappé l’agent de sécurité et sous la menace d’une arme de poing, les malfaiteurs se sont fait ouvrir le coffre. Ils ont raflé quelques milliers d’euros avant de fuir. La PJ-92 enquête.",Clichy,92110,61070
